ID,reviews,location,service,price,environment,dish
878,其实我很愿意用美团的，评价的时候尽量说好的。但是这餐饭实在是不能好评。以前我们单位在这附近，所以经常时常过来吃，但也有时不愿意来，因为服务员总是让你添点别的菜，不点的话就不愿意。虽然有时候有点不开心，但是觉得鸡汤还好就没有计较。单位搬家后几乎两年没去了，昨晚又去喝了鸡汤。天呀！以前香气扑鼻的参味没有啦，鸡肉很柴，汤也很清。鸡比以前还小多了，肚里的糯米很少很少，以前还有参须的。现在连影都看不见了，汤里一点参味也没有啦！真的比以前差的太多了。不过服务员比以前那个大嗓门的阿姨好多了，还有烤牛肉饭虽然是甜口的，味道和量真的是比吉野家不差的。这家首推的是参鸡汤，但是他家的参鸡汤实在是质量下降的太多了。,Not Mentioned,Neutral,Not Mentioned,Not Mentioned,Negative
898,石锅拌饭油太大啦 感觉上菜很着急,Not Mentioned,Negative,Not Mentioned,Not Mentioned,Neutral
904,想提前预约，可是服务员竟然说自己很忙告诉我不能预约，去之前问团购卷能用吗？他们说能用，去了又说团购的卖完了。。。晕。。。。后来还是用了团购,Not Mentioned,Negative,Neutral,Not Mentioned,Not Mentioned
908,还算满意 味道也可以 就是贵了点,Not Mentioned,Not Mentioned,Negative,Not Mentioned,Positive
913,实在不满意。因为味道了不好 感觉一般般,Not Mentioned,Not Mentioned,Not Mentioned,Not Mentioned,Negative
915,汤品很不错，团的看着便宜，但是饮料太贵了，三份饮料加两份米饭又花了我60多大洋，结果饮料三口喝完了,Not Mentioned,Not Mentioned,Negative,Not Mentioned,Positive
924,跟咸很闲很咸  只有这个感觉 不划算,Not Mentioned,Not Mentioned,Negative,Not Mentioned,Negative
926,土豆有点少、肉是已经脱骨了、味道还行,Not Mentioned,Not Mentioned,Not Mentioned,Not Mentioned,Negative
930,对于一个初到大连的人来说，地方有点难找，本来以为有电梯可以上去的，结果发现二楼没有电梯。参鸡汤的鸡肉一般般，不过汤很鲜，值得一试。肥牛饭一般吧，小菜的味道挺不错的，两个人吃可能会有点少就是。总的来说还不错,Negative,Not Mentioned,Not Mentioned,Not Mentioned,Positive
931,口味不错，饮料太贵了，估计商家把菜品的钱加到饮料里了，团完60多的菜又加了60多的饮料～不过人家也没强制让你加东西，不过还是建议去的朋友自带一些水吧,Not Mentioned,Not Mentioned,Negative,Not Mentioned,Positive
935,真的是太差了，根本不值58，就一点茼蒿和蘑菇，蘑菇根都在里面，做的很糊弄，两小根年糕还很难吃，骨头不新鲜，俩人根本不够吃，夏天吃还跟幔米饭5元一碗！！！太不值！！不会再去了！！这次团购很失败！,Not Mentioned,Not Mentioned,Negative,Not Mentioned,Negative
943,味道不错、就是价格没有以前便宜了！,Not Mentioned,Not Mentioned,Negative,Not Mentioned,Positive
961,很小很小的鸡 一点也不好吃 说好的人节操呢？,Not Mentioned,Not Mentioned,Not Mentioned,Not Mentioned,Negative
963,环境不错的，就是有点闷热，上菜很快，不过那个猪蹄有点小贵，总体很好,Not Mentioned,Positive,Negative,Positive,Positive
972,特别难喝 不能再去了 太难喝了,Not Mentioned,Not Mentioned,Not Mentioned,Not Mentioned,Negative
974,汤快喝完了竟然吃了半根头发出来，服务员表示可以加汤，把汤换掉…算了吧，剩下的不喝了，之前的不想了…,Not Mentioned,Neutral,Not Mentioned,Negative,Not Mentioned
975,环境一般吧，，可能期望太高了，，服务也一般，，有个前台的小伙挺好， 菜品⒓μ啦淮恚很嫩，海鲜饼好吃，其他凑合。特别说说炸鸡排，，以为是炸的，，结果上来是炒的，，服务员说炒炸5鸡，，可是菜单的图片和实物完全不一样，虽说图片仅供参考，但是图片是鸡排啊，，上来的是一锅鸡块炒大白菜加3条年糕，，锅很大，，量特少，，刚一端来我行思怎么把哪桌吃剩的菜端这来了？，，，还80那，，， 坑！看大家都说脊骨火锅好吃，有机会去试试，，,Not Mentioned,Neutral,Negative,Neutral,Negative
982,停车挺不方便。我觉得真好吃啊，下次还想吃。,Not Mentioned,Negative,Not Mentioned,Not Mentioned,Positive
997,饭菜还可以。但服务真的很差 我能说服务员一听我们是团购的菜单往桌子上一摔转身就走吗 还一副爱谁谁的样 另一个胖一点的服务员还跟另一桌团购的吵起来 另一桌当时就说她服务态度差她理都不理。我不知道你们家老板会不会来看评价 我想说既然你弄团购了就好好做 一家店的服务员就相当于门脸一样 没人消费的时候爱看一张哭丧的脸。建议好好管理一下自家服务员吧。,Not Mentioned,Negative,Neutral,Not Mentioned,Neutral
1010,地方不太好找…环境略显陈旧…鸡汤很淡…也没看见参…海鲜饼还不错点了两份…,Negative,Not Mentioned,Not Mentioned,Negative,Neutral
1011,态度太差！！！再也不会去了。问服务员事情跟吃枪药似的。味道也没有说的那么好。这样的店我想知道怎么还有那么多人愿意去！在大连去过服务态度最差的店！,Not Mentioned,Negative,Not Mentioned,Not Mentioned,Neutral
1017,地方不太好找…装修略显陈旧…鸡汤很淡…没看着有参…海鲜饼还不错,Negative,Not Mentioned,Not Mentioned,Negative,Neutral
1033,和韩国差不多，但参鸡汤味道淡，环境很不错。地方需要找一下。有机会再去！,Negative,Not Mentioned,Not Mentioned,Positive,Neutral
1038,要求不高的可以，味道真的一般，辣白菜太酸，不好吃，环境还可以，不好停车！,Not Mentioned,Negative,Not Mentioned,Positive,Neutral
1040,服务员很差，反正就是一次很不好的经历。绝对不会去了。,Not Mentioned,Negative,Not Mentioned,Not Mentioned,Not Mentioned
1041,上菜有点慢 味道还不错吧 鸡肉很软 。,Not Mentioned,Negative,Not Mentioned,Not Mentioned,Neutral
1043,菜品的味道 非常不错  就是环境差了一点儿！！总体还是 80分以上  很实在的 一个 小聚地方,Not Mentioned,Not Mentioned,Not Mentioned,Negative,Positive
1048,一般吧，小贵，菜就刚刚好，吃完不饿了,Not Mentioned,Not Mentioned,Negative,Not Mentioned,Neutral
1050,不是第一次来了，如果团购优惠能同时使用就更好了呢,Not Mentioned,Not Mentioned,Negative,Not Mentioned,Not Mentioned
1059,和同事一起吃的#脊骨火锅# 量大，肉烂，入口即化，不腻，同事平常不爱吃肉，都吃了两块 可见口味非常不错，给赞，就是米饭有点小贵，五元一碗，会继续支持。,Not Mentioned,Not Mentioned,Negative,Not Mentioned,Positive
1061,石锅拌饭很正宗，参鸡汤也很好喝，就是楼下不太好停车。,Not Mentioned,Negative,Not Mentioned,Not Mentioned,Positive
1063,口味不是特别惊艳，但是不难吃，重点的是很补，热腾腾的鸡汤喝的很舒服，但是我去的时候他说团购的要预约感觉比较麻烦，我不是饭点儿去的而且还没团不让吃我就走他们才让我进的,Not Mentioned,Negative,Neutral,Not Mentioned,Positive
1072,超级差…鱼不新鲜，菜量超小，价格很贵，不会再去第二次,Not Mentioned,Not Mentioned,Negative,Not Mentioned,Negative
1093,没有预约就去了    等的时间有点长    原本就团了一个参鸡汤   但是在等的时间有点了一个炒杂菜   味道还是挺不错的,Not Mentioned,Negative,Neutral,Not Mentioned,Positive
1099,参鸡汤很好，已经来过好多次了。一个人一份参鸡汤就足够吃了，点其他吃不下。不过服务态度真的就只能说过得去，有些爱答不理的，是不是人很多的原因呢。还有要推荐土豆沙拉！好吃啊！做的口味超级棒，下次准备尝尝里脊火锅。,Not Mentioned,Negative,Not Mentioned,Not Mentioned,Positive
1106,一般吧。热。越来越不好吃。。。。，,Not Mentioned,Not Mentioned,Not Mentioned,Not Mentioned,Negative
1113,吃了包肉，泡菜饼，参鸡汤，还有一个锅…团购也很贵，偶尔吃吃改善生活挺好的,Not Mentioned,Not Mentioned,Negative,Not Mentioned,Not Mentioned
1123,"一般,比起首尔的参鸡汤差很多,米就少很多，还可以吧",Not Mentioned,Not Mentioned,Not Mentioned,Not Mentioned,Negative
1128,听广播推荐的，来了之后人很多，做了半天没人招呼。还有人抽烟！！打包了一份参鸡汤，居然用个破的塑料袋给我装，然后听说我要用美团，马上脸就沉下来了，说要预约什么什么的。心情很差！喝了鸡汤心情更差！不会再去第二次了。,Not Mentioned,Negative,Not Mentioned,Negative,Not Mentioned
1133,真的不错，参鸡汤挺好吃的，服务态度也挺好，就是放的歌我不太喜欢,Not Mentioned,Positive,Not Mentioned,Negative,Positive
1138,太难吃了，我家宝贝都吃恶心了，差点吐,Not Mentioned,Not Mentioned,Not Mentioned,Not Mentioned,Negative
1140,位置很好找，上电梯就能看到，验证也很快，只是等了快20分钟了，服务员却过来问点的是什么，顿时无语，居然搞错了，口味还挺好的，鸡肉很嫩，只是本人不爱吃黏的，所以糯米没吃几口，总体评价不错,Positive,Negative,Not Mentioned,Not Mentioned,Positive
1142,服务态度极差，鸡汤不浓郁，很小一只鸡。味道越来越差。再也不去了。,Not Mentioned,Negative,Not Mentioned,Not Mentioned,Negative
1146,味道还可以，一个正常饭量的女生大概够吧，店家很好说话，本来不可以再加小菜的，结果要了就给了一大盒，赞赞赞！就是位置有些不好找,Negative,Positive,Not Mentioned,Neutral,Positive
1153,人很多，1点多去的告知参鸡汤已经售空，需要等，不枉费我等那么久，好吃,Not Mentioned,Negative,Not Mentioned,Not Mentioned,Positive
1162,和另外两个同学一起来吃的，好吃便宜又实惠。但是有点不完美的是店里的通风和排油烟都不是很到位，吃完饭搞得一身一头油呼呼粘粘的味道。有点恶心。其次，服务员的态度不是很贴心，这参鸡汤算是韩国菜，但是服务员不应用自己的眼光去判断客人，露出一副没见过你们这么吃东西的表情。我只想说，作为一个正宗的朝鲜族，我比你知道的多得多,Not Mentioned,Negative,Positive,Negative,Positive
1164,用了这么多美团，第一回做评价，感觉做生意不容易，但是这次真的忍不了，对于九月二十二号晚的前台服务员态度极其恶劣，一说团购，就拉个脸子，因为第一次来，不知道菜里有啥，不知道份量够不够，问了没好气，眼睛一瞪一瞪，我就想我是来消费的，结果吃一肚子气，对于这种服务一星都不想给，前台像家死人一样，我吃饭看你脸子来了？建议别人下次不要来！看不惯***看人底,Not Mentioned,Negative,Neutral,Not Mentioned,Not Mentioned
1166,"去过很多次了。唯一一点不好。 就是没洗手间。 菜做的很好。 喜欢韩式料理。因为不论你点什么。他会送你好几种韩式小菜。 还有他家冷面不好吃。 还没有家乐福里卖7块的半成品冷面好吃。推荐参鸡汤。脊骨火锅。牛肉饭

",Not Mentioned,Not Mentioned,Not Mentioned,Negative,Positive
1181,第一次上的汤里有小虫，服务员很不情愿地换了一锅，里头的鸡竟然少翅膀，味道还行，就是服务员的态度有待提高。,Not Mentioned,Negative,Not Mentioned,Negative,Neutral
1182,味道感觉很好，地方小了点，服务员服务不是很及时。,Not Mentioned,Negative,Not Mentioned,Negative,Positive
1190,脊骨火锅很好吃，就是服务不好，一边打电话一边结账一点礼貌都没有，就算再好吃也不来了，让人感觉很不舒服。,Not Mentioned,Negative,Not Mentioned,Not Mentioned,Positive
1193,味道很好，店里其他东西也好吃，只是比较贵,Not Mentioned,Not Mentioned,Negative,Not Mentioned,Positive
1203,去过好多次了，味道跟以前一样，但是团购涨价了。#脊骨火锅（小）# #参鸡汤#,Not Mentioned,Not Mentioned,Negative,Not Mentioned,Neutral
1204,终于停上车了，一直喜欢喝他家的参鸡汤和牛尾汤，，就是没有车位，吧台的小帅哥非常给力。继续购买,Not Mentioned,Negative,Not Mentioned,Not Mentioned,Not Mentioned
1210,东西有点少，不够2个人吃的，去了店里看到价格表了，感觉就是东西随着钱变少了，不过味道还不错。吃的是老板娘推荐的芝士年糕火锅。总体来说，还不错啦。店里关键也不错哦，小菜里的萝卜菜很不错,Not Mentioned,Not Mentioned,Negative,Positive,Neutral
1211,没有期望的好，，⒓μ啦淮恚很嫩，海鲜饼好吃，，炸鸡排***，是炒的，鸡块炒大白菜，量少，服务员端来我行思怎么把哪桌吃剩的菜端这了？总体贵，,Not Mentioned,Negative,Negative,Not Mentioned,Negative
1216,这次量比平时小，希望以后能保质保量,Not Mentioned,Not Mentioned,Not Mentioned,Not Mentioned,Negative
1227,去了很多次了，不过水果沙拉就别点了，25全是苹果有几个橘子估计是罐头，25，基本都没吃，太不好吃了！其他的一如既往的好吃！,Not Mentioned,Not Mentioned,Neutral,Not Mentioned,Negative
1228,很好吃很实惠 就是地方太不好找了 找了好久才到,Negative,Not Mentioned,Positive,Not Mentioned,Positive
1247,都好  就是太不好吃啦 什么都不想再讲了,Not Mentioned,Not Mentioned,Not Mentioned,Not Mentioned,Negative
1267,总来的一家店！今天就是让我不舒服！十一点来的！店内没有客人！等了很久！一直低头看电话！抬头发现后边去的客人已经做好了！难道团购的就是排在后边吗？问服务员！我的什么时候能好？服务员不耐烦的说！做着呢！突然很怀念他家的老爷爷！,Not Mentioned,Negative,Not Mentioned,Not Mentioned,Not Mentioned
1270,拌饭那个饭简直了! 比粘米还粘，在也不会吃了！参鸡汤不错,Not Mentioned,Not Mentioned,Not Mentioned,Not Mentioned,Negative
1271,不好吃，汤不好喝，饭也是不喜欢，后悔莫及,Not Mentioned,Not Mentioned,Not Mentioned,Not Mentioned,Negative
1281,还不错，就是有点小!整体可以!,Not Mentioned,Not Mentioned,Not Mentioned,Negative,Neutral
1288,经济实惠，便宜超值，停车不方便,Not Mentioned,Negative,Positive,Not Mentioned,Not Mentioned
1298,还可以吧 团购价格合适 但是店内服务员少 也不是很热情 牛尾汤的锅明显比参鸡汤小 但是胜在价格便宜,Not Mentioned,Neutral,Positive,Not Mentioned,Negative
1304,老板人很差，东西还是比较好吃，可是服务真的很不好，还说顾客,Not Mentioned,Negative,Not Mentioned,Not Mentioned,Positive
1316,服务态度差的不能再差！服务员给人一种我很牛逼的感觉 点个菜***爱搭不理！吃的也就那样吧 别有什么期待,Not Mentioned,Negative,Not Mentioned,Not Mentioned,Neutral
1327,还行吧，就是有点贵，呵呵呵。。。,Not Mentioned,Not Mentioned,Negative,Not Mentioned,Not Mentioned
1343,味道很好 就是米饭五元 略贵 不过味道很好,Not Mentioned,Not Mentioned,Negative,Not Mentioned,Positive
1359,可能临近春节。水平严重没有希尔顿的水平 饭不好吃,Not Mentioned,Not Mentioned,Not Mentioned,Not Mentioned,Negative
1368,很好的 就是太慢了上餐    环境不错 味道不错,Not Mentioned,Negative,Not Mentioned,Positive,Positive
1377,不错，就是牛尾汤给的太少了，不知道是不是团购的原因，再给这么少下次可就不去了。,Not Mentioned,Not Mentioned,Negative,Not Mentioned,Negative
1378,就是太贵啦，还行吧！怎么会有人问啊,Not Mentioned,Not Mentioned,Negative,Not Mentioned,Not Mentioned
1382,菜品少，菜味太一般，服务也是不咋地，不会再来。,Not Mentioned,Negative,Not Mentioned,Not Mentioned,Neutral
1396,团购里根本没有注明不能使用团购的时间是因为休息，我以为只是那个时间段不能用，我正常消费还不行？打电话服务员声音极小，谁知道他们在睡觉？睡觉倒是别接电话呀，在外面等了1个小时开门了，服务态度极差，刚刚接电话的服务员还故意在我们旁边很大声的说，我在电话里说听不清楚，废话，知道你们几个人一起睡觉呀，还是那句话，不方便就别接电话，接电话让人听不清楚，什么玩意,Not Mentioned,Negative,Neutral,Not Mentioned,Not Mentioned
1413,告诉他是给病人吃的不要葱姜蒜！除了葱味什么味都没有！破打包盒还5块钱,Not Mentioned,Not Mentioned,Negative,Not Mentioned,Negative
1423,东西还是很不错的，但是环境和服务差强人意，还有不团购的话很不合适,Not Mentioned,Negative,Negative,Negative,Not Mentioned
1424,参鸡汤味道不错 但是石锅拌饭里面有头发是怎么回事 失望,Not Mentioned,Not Mentioned,Not Mentioned,Negative,Positive
1426,今天去吃还有带狗去的，服务员没有任何阻止行为，在旁边说说笑笑，，手舞足蹈，团购验证的时候也搞错了，等了好久才上来，味道也和之前差了很多，总之不会再去了,Not Mentioned,Negative,Not Mentioned,Not Mentioned,Neutral
1428,好小的一只鸡籽，都没吃饱，后悔了,Not Mentioned,Not Mentioned,Not Mentioned,Not Mentioned,Negative
1430,去过好多次这家店了，可服务是越来越差，服务员都没有一个有笑容！！吃得不开心，不再去了！！！,Not Mentioned,Negative,Not Mentioned,Not Mentioned,Not Mentioned
1447,挺好的吃的，继续保持！环境挺好好。不方便停车啊！,Not Mentioned,Negative,Not Mentioned,Positive,Positive
1448,第一有评价的需求是因为实在更吐槽一下，这个店实在是不怎么样啊，价格贵，味也就那样。点的脊骨火锅100一份，用券合着也是79，真心不好吃，那你合算也行啊，一个烤五花肉40就十二三块肉吧，再也不去了,Not Mentioned,Not Mentioned,Negative,Not Mentioned,Negative
1480,太差劲了，店名叫“宫廷参鸡汤”，整个汤里没发现参在哪，弄个树根装装样子可以吗？鸡汤没点鸡味，鸡肉有腥味，汤咸，烤牛肉饭和外面卖的一般牛肉饭一样，没看出来也吃不出来是烤的。总之失望透了,Not Mentioned,Not Mentioned,Not Mentioned,Not Mentioned,Negative
1486,东西好吃，车难停啊！但是，还要继续光顾啊，因为还想吃啊！,Not Mentioned,Negative,Not Mentioned,Not Mentioned,Positive
1489,味道不错，22元的价格很实惠，环境也很好，就是地方不是太好找！餐具不干净，杯子里还有张东西，,Negative,Not Mentioned,Positive,Positive,Positive
1493,单点48太贵了，还是团购便宜。,Not Mentioned,Not Mentioned,Negative,Not Mentioned,Not Mentioned
1502,凑合吧，味道一般，好贵的啊，个人不会再去了,Not Mentioned,Not Mentioned,Negative,Not Mentioned,Neutral
1506,口味喜欢，一直去，以前有个小姑娘，服务态度特别好，这次没看见她，其他人的服务也是醉了,Not Mentioned,Negative,Not Mentioned,Not Mentioned,Positive
1518,很好喝 很赞的高中就一直去 但是这次吃出头发,Not Mentioned,Not Mentioned,Not Mentioned,Negative,Positive
1522,鸡汤很淡很淡很淡，牛肉饭比吉野家差远了,Not Mentioned,Not Mentioned,Not Mentioned,Not Mentioned,Negative
1535,味道清淡，适合我的口味，服务不怎么样牛的很，量小不够两个人吃。,Not Mentioned,Negative,Not Mentioned,Not Mentioned,Negative
1560,去了说要提前三小时预约那些团购、只有这个能用、价高,Not Mentioned,Not Mentioned,Negative,Not Mentioned,Not Mentioned
1569,味道不错～服务员太呆恨！像桑门似的！比了巴拉的！冲着点就不想去，味道确实一直都觉得不错！但不会再去了！,Not Mentioned,Negative,Not Mentioned,Not Mentioned,Positive
1570,菜价偏贵，鸡汤葱味重。打包费一份菜就要5元。,Not Mentioned,Not Mentioned,Negative,Not Mentioned,Neutral
1575,味道不错，不过58的脊骨火锅团购，店员说必须至少提前三个小时预定才可以用。结果我们去到店里买的79元券才吃上。,Not Mentioned,Not Mentioned,Negative,Not Mentioned,Positive
1590,参鸡汤很一般吧…牛尾汤比较小 不会再想吃了…服务比较差 没人理啊！,Not Mentioned,Negative,Not Mentioned,Not Mentioned,Negative
1594,东西蛮好吃，就是服务有待提高，对团购的客人限制比较多。,Not Mentioned,Negative,Neutral,Not Mentioned,Positive
1603,环境好，味道好，值得购买，不团购好贵呢。,Not Mentioned,Not Mentioned,Negative,Positive,Positive
1606,鸡汤还可以，就是袖珍了一些。不过价格不算便宜,Not Mentioned,Not Mentioned,Negative,Not Mentioned,Negative
1609,团购挺合适的，就是菜单上的菜都蛮贵的，,Not Mentioned,Not Mentioned,Negative,Not Mentioned,Not Mentioned
1615,还可以，就是小了点，男的不够吃，,Not Mentioned,Not Mentioned,Not Mentioned,Not Mentioned,Negative
1622,差不错差不错还不错，服务态度不太热情,Not Mentioned,Negative,Not Mentioned,Not Mentioned,Positive
1628,味道不错，值得推荐，人很多，需要早点,Not Mentioned,Negative,Not Mentioned,Not Mentioned,Positive
1631,态度不太好，烤牛肉饭好吃，参鸡汤的鸡很小,Not Mentioned,Negative,Not Mentioned,Not Mentioned,Neutral
1633,味道还是一样的，就是感觉比以前吃的正价的小了，小了很多。,Not Mentioned,Not Mentioned,Not Mentioned,Not Mentioned,Negative
1642,东西不错 唯一不足的是米饭还得自己买 一碗5元 挺贵啊！,Not Mentioned,Not Mentioned,Negative,Not Mentioned,Not Mentioned
1643,这次跟弟弟来吃得～跟上次一样好～米饭贵！,Not Mentioned,Not Mentioned,Negative,Not Mentioned,Positive
1672,他家太恶心了，非得让提前预约2小时，没预约到了有座都不招待你，你说黑不黑，菜啥的还是挺不错的,Not Mentioned,Negative,Not Mentioned,Not Mentioned,Positive
1675,味道尚可，环境也算可以，但是服务员的态度不敢恭维。,Not Mentioned,Negative,Not Mentioned,Positive,Neutral
1683,越做越难吃啊！汤一点味道都没有！,Not Mentioned,Not Mentioned,Not Mentioned,Not Mentioned,Negative
1686,服务越来越差，东西也没以前好吃，白毛高丽棒子老头没了？,Not Mentioned,Negative,Not Mentioned,Not Mentioned,Neutral
1693,挺好吃的，就是离我远点。米饭贵点！去到又点了角瓜饼，味道还不错，也是少了点！总的还可以！,Not Mentioned,Not Mentioned,Negative,Not Mentioned,Neutral
1705,味道还不错。服务员木讷的很。还会去,Not Mentioned,Negative,Not Mentioned,Not Mentioned,Positive
1709,菜的味道还可以，肉是炖过得，也不知道新鲜不新鲜，米饭太贵了，5块钱一碗，真心吃不起米饭啊,Not Mentioned,Not Mentioned,Negative,Not Mentioned,Neutral
1725,一直很钟爱她家的韩餐，今天是中午过去的但是就是人太多了，排了半天没地方坐就打包带走了。点的大酱汤，味道不错，就是稍微有点咸。中午有个团购套餐，15块钱，有好多种类可任意挑选。性价比还是挺高的，要不然他家单点一碗饭还要五元那。,Not Mentioned,Negative,Positive,Not Mentioned,Positive
1729,很好吃，去过很多次了，不过没有之前的优惠力度大了。,Not Mentioned,Not Mentioned,Negative,Not Mentioned,Positive
1731,为毛鸡肚子里是米，，，不咋的，,Not Mentioned,Not Mentioned,Not Mentioned,Not Mentioned,Negative
1737,我觉得拌饭不错。拌饭不用团购，到店吃就是15元。脊骨火锅要是不团购到店吃是100元。整体服务还不错位置比较好找，味道一般，确实不知道为什么评论里那么多人都说好，可能我吃过别人家的，对比后真心觉得一般，量也不是特别大，参鸡汤上来的时候我妈说这是童子***。脊骨火锅感觉不出来哪里特别好。,Positive,Positive,Neutral,Not Mentioned,Negative
1747,好吃！人少---汤正！物美价廉，就是地方难找，夏天冷气好像不太足哈哈哈不过和特色了！推荐！赠送残骸照一张！哈哈哈哈,Negative,Not Mentioned,Positive,Not Mentioned,Positive
1765,菜品挺贵的，但是味道很好。挺正宗,Not Mentioned,Not Mentioned,Negative,Not Mentioned,Positive
1770,服务不怎么滴，特别前台收银小伙，特瞧不起团购，定好12点吃，结果十二点半才上菜，下午上班都来不及了！,Not Mentioned,Negative,Negative,Not Mentioned,Not Mentioned
1783,现打得电话就去了～～～服务不错，就是米饭太贵了～～哈哈，跟朋友去吃的，非常不错！,Not Mentioned,Positive,Negative,Not Mentioned,Not Mentioned
1789,打电话给店家声音很小根本听不清，然后态度很恶劣摔电话，差评不解释,Not Mentioned,Negative,Not Mentioned,Not Mentioned,Not Mentioned
1792,前台收银男的服务太次！影响心情！东西还好，不想再来第二次,Not Mentioned,Negative,Not Mentioned,Not Mentioned,Not Mentioned
1802,好吃，还会在来的，就是打包费要五元，是不是好贵,Not Mentioned,Not Mentioned,Negative,Not Mentioned,Positive
1803,非常好。就是牛肉68感觉很不值，还不如一碗30的牛肉饭好吃。,Not Mentioned,Not Mentioned,Negative,Not Mentioned,Neutral
