ID,reviews,location,service,price,environment,dish
1805,汤什么不错，唯一不足就是米饭需要单点，单点也就罢了，碗小的可怜不说，竟然要五元钱…,Not Mentioned,Not Mentioned,Negative,Not Mentioned,Negative
1808,汤还可以，但一小碗米饭需要5元钱，感觉是极无诚意的团购。,Not Mentioned,Not Mentioned,Negative,Not Mentioned,Neutral
1812,很不错喔~ 去过很多次~ 就是价格一直再涨~入秋了 又到了和参鸡汤的时候了~,Not Mentioned,Not Mentioned,Negative,Not Mentioned,Not Mentioned
1813,好想这两天再去吃，只是停车困难点，清淡和营养的最佳结合。,Not Mentioned,Negative,Not Mentioned,Not Mentioned,Not Mentioned
1818,东西其实这个价不太贵但是前台的小姑娘态度不太好，一看是团购各种不满的样子～…东西其实味道挺好的～,Not Mentioned,Negative,Neutral,Not Mentioned,Positive
1823,这个参鸡汤很好吃，就是服务员的态度差些，当时没有预约，因为看错了，但不是故意的，可是服务员左来一个说一遍，右来一个说一遍，好像这顿饭是设施给我们的，感觉不爽,Not Mentioned,Negative,Not Mentioned,Not Mentioned,Positive
1845,感觉还不错，不太好停车，口味还可以。,Not Mentioned,Negative,Not Mentioned,Not Mentioned,Positive
1852,来了很多回了，就是每次打电话预约比较费劲,Not Mentioned,Negative,Not Mentioned,Not Mentioned,Not Mentioned
1855,可能是人多的关系 ，服务员都叫不到，答应了半天都没回复，东西上的很慢，前台的服务态度很差。,Not Mentioned,Negative,Not Mentioned,Not Mentioned,Not Mentioned
1863,各方面都很好，就是服务太差，有点瞧不起人的感觉，团购怎么了？团购不是花钱去的吗？这帮***看人低的老娘们讨厌,Not Mentioned,Negative,Neutral,Not Mentioned,Not Mentioned
1865,味道一般 价格也不便宜 一碗米饭居然5块 真是很一般,Not Mentioned,Not Mentioned,Negative,Not Mentioned,Neutral
1869,很好吃，就是米饭太贵！五元一碗！,Not Mentioned,Not Mentioned,Negative,Not Mentioned,Positive
1870,鸡都有味了还给顾客上啊 臭了都。能不能行了,Not Mentioned,Not Mentioned,Not Mentioned,Negative,Negative
1871,口味可以达，很好吃，但是基本没有服务，很热的天不开空调，算了，为了美味忍受一下啦,Not Mentioned,Negative,Not Mentioned,Not Mentioned,Positive
1877,口味不错 再加的蔬菜 很过瘾 足够两人吃了 停车不方便,Not Mentioned,Negative,Not Mentioned,Not Mentioned,Positive
1878,好吃，不过因为是团购，就让坐那么憋屈的小桌子，还点了很多其他的东西呢，这点不好,Not Mentioned,Not Mentioned,Neutral,Negative,Positive
1879,骨肉给的特别多两个人根本吃不完唯一不好的就是米饭五块钱 太不合适了,Not Mentioned,Not Mentioned,Negative,Not Mentioned,Positive
1885,自己一个人吃的 没吃了 味道挺好的 以后还会来 缺点是服务员态度太差,Not Mentioned,Negative,Not Mentioned,Not Mentioned,Positive
1890,团购的真的很合适，自己去吃的话有点小贵，总体还不错，赞！,Not Mentioned,Not Mentioned,Negative,Not Mentioned,Positive
1897,鸡肉口感很差，应该不是好鸡！只喝了点汤，下次再也不会去了！服务态度别提了，5个人去，只给一份小菜，萝卜时间太长，都软了，很不新鲜！店员还说，小菜能吃饱啊！真是理解不了，作为服务员这态度，估计是家庭不和！,Not Mentioned,Negative,Not Mentioned,Not Mentioned,Negative
1905,整体一般，除了团购外，单点菜品单价都偏贵，口味还可以，就是感觉鸡汤做的没有在北京喝的店里面新鲜，辣白菜挺不错的，泡菜饼也不错,Not Mentioned,Not Mentioned,Negative,Not Mentioned,Neutral
1911,还行！其他的都很贵！,Not Mentioned,Not Mentioned,Negative,Not Mentioned,Not Mentioned
1915,参鸡汤不错，口感细嫩，汤汁鲜美，小菜是一桌只赠一套(四小碟），服务还行，环境也不错，可能是去的早吧，人不多，但他家必须提前一到两天定位，团购每天限量接待！他家价位算比较贵的！,Not Mentioned,Positive,Negative,Positive,Positive
1918,可以说很期待 但是店家老板是韩国人 做出来的味道 却失望了 跟在韩国吃的差好多,Not Mentioned,Not Mentioned,Not Mentioned,Not Mentioned,Negative
1919,打电话预定的时候接电话的人态度好差，说话很生硬,Not Mentioned,Negative,Not Mentioned,Not Mentioned,Not Mentioned
1924,汤的味道的确不错，东西值得去吃，可是服务真的很差，打电话问具体地点，服务员爱答不理的，让再找找，第一次去的可一定查查路线,Negative,Negative,Not Mentioned,Not Mentioned,Positive
1931,因为要外带，所以就可以弄虚作假，欺骗消费者吗？整件事情你们心知肚明。鸡的颜色整体是暗色的，有一部分竟然是暗红色的，里面的糯米是夹生的，还强词说都是这样，虽然最后给重新换了，总之不会再去了，也不会推荐。,Not Mentioned,Not Mentioned,Not Mentioned,Not Mentioned,Negative
1933,很淡，味道不是很好，其他菜都比一般的韩国馆要贵！额外叫的辣白菜炒饭也不好吃，25一份，一碗米饭就要五块钱，再不会来了！很失败的一次团购！,Not Mentioned,Not Mentioned,Negative,Not Mentioned,Negative
1935,还得提前预约，规定日期，服务差！,Not Mentioned,Negative,Not Mentioned,Not Mentioned,Not Mentioned
1938,环境还行，简约！参鸡汤还行，虽说和在韩国吃的有些差异，但还算挺好吃！其他菜品贵！,Not Mentioned,Not Mentioned,Negative,Positive,Positive
1939,接电话的男的'永远令人那么反感,Not Mentioned,Negative,Not Mentioned,Not Mentioned,Not Mentioned
1942,味道变了，鸡有一股味儿，下次不敢吃了。,Not Mentioned,Not Mentioned,Not Mentioned,Not Mentioned,Negative
1944,挺好的，就是里面那个男服务员。感觉很是不热情，里面女服务员特别好。,Not Mentioned,Negative,Not Mentioned,Not Mentioned,Not Mentioned
1946,服务特别差，太差了，我们来吃饭，像得罪服务员似的，特别差，菜品的味道也不好，牛肉饭太油，鸡汤根本没有入味，感觉不是一起炖的，肯定不会再来。。什么破店。。。。,Not Mentioned,Negative,Not Mentioned,Not Mentioned,Negative
1950,很久没去了  鸡汤味道没有变 只是鸡变小了,Not Mentioned,Not Mentioned,Not Mentioned,Not Mentioned,Negative
1955,每次打电话，那个女的还好，那个男的我好像骂他，非常装，打一次电话我生气一次一听团购态度马上恶劣，令人鄙视。,Not Mentioned,Negative,Neutral,Not Mentioned,Not Mentioned
1956,味道还可以 菜的品质还是有目共睹的 就是太贵 团购还算比较合适,Not Mentioned,Not Mentioned,Negative,Not Mentioned,Positive
1957,服务员态度太差 2点去 点了汤烤肉 告诉让我们快点吃 3点就闭灯闭店休息！态度太差 白瞎了好参鸡汤！,Not Mentioned,Negative,Not Mentioned,Not Mentioned,Not Mentioned
1960,味道真的很满意，服务真的很差，一定要提前约，一桌也只能用一张，若多人去另外再约就会告诉已经满了，冲着这个服务真心不想再去,Not Mentioned,Negative,Not Mentioned,Not Mentioned,Positive
1962,老顾客了～服务员态度还是一如既往的不好，白头发的张师傅人很好！,Not Mentioned,Negative,Not Mentioned,Not Mentioned,Not Mentioned
1965,环境不错，也挺好吃的，分量也足，两个人够吃了，不过，米饭5元钱一碗是不是有点儿离谱呀！普通的白米饭，5元钱一碗，是我吃过最贵的了！而且店里的菜单没有标价，我们点米饭的时候没有看到菜单上有价格哦！这点让我心里很不爽！,Not Mentioned,Not Mentioned,Negative,Positive,Positive
1979,非常满意，脊骨很多肉，吃的很饱，就是米饭贵了点5元一小碗。不过总体还好啦！,Not Mentioned,Not Mentioned,Negative,Not Mentioned,Positive
1980,店内环境好，也非常好吃，停车不方便。,Not Mentioned,Negative,Not Mentioned,Positive,Positive
1981,东西不错，就是服务态度血差！男服务员服务态度挺好，那两个女的，简直目中无人，说话服务态度都特差，以前看评价还不信，没想到自己来吃真的是这样。我来时一个人都没有，服务员还跟我争吵，很长很长时间不给上菜，问一下做没做，告诉后厨还没下单子做。来这不吃饭光受气了。老板是不是该考虑一下，这么好吃的店有这样的服务员会不会招客？反正我下次不会再来了。,Not Mentioned,Negative,Not Mentioned,Not Mentioned,Positive
1983,口味很一般，定两份套餐，两人用餐只给一份小菜，而且服务员态度很差，似乎美团不是给她们送钱，感觉很不好，不会再去!,Not Mentioned,Negative,Not Mentioned,Not Mentioned,Neutral
1986,越来越差了，里面的糯米饭是凉的，哎呦，好失望的。,Not Mentioned,Not Mentioned,Not Mentioned,Not Mentioned,Negative
1987,东西挺好但不是我的口味，服务员都不知道跑哪了，问后厨根本不搭理,Not Mentioned,Negative,Not Mentioned,Not Mentioned,Positive
1991,服务太差，让人感觉花钱的顾客似乎欠他们的,Not Mentioned,Negative,Not Mentioned,Not Mentioned,Not Mentioned
1992,团购就不是顾客么？服务态度好差,Not Mentioned,Negative,Neutral,Not Mentioned,Not Mentioned
2001,锅挺好吃，量很大，但是米饭太贵了，竟然5块一碗，就是一般大米饭啊,Not Mentioned,Not Mentioned,Negative,Not Mentioned,Positive
2004,东西不错，还挺好吃的。就是服务员服务态度太太太差！老板真的该考虑一下这样的服务员会不会给你的店带来效益。反正我是吃完这次不会再来了！,Not Mentioned,Negative,Not Mentioned,Not Mentioned,Positive
2009,味道很好，就是服务员态度很差！餐具不怎么干净！！,Not Mentioned,Negative,Not Mentioned,Negative,Positive
2010,是不是它家团不起了啊？！以前去的时候，几种团购可以一起用！现在可倒好，全部不能一起用！还不标注，去吃饭才告诉！丫的带别人去 吃饭三张团购只能用一张，太尴尬了！太恶心了！打电话的时候说除了参鸡汤和脊骨锅，其他都能一起用，去了又说代金券不能一起用。白去那么多次了，就冲这一次，把它家其他团购全退了，再也不去了！,Not Mentioned,Negative,Negative,Not Mentioned,Not Mentioned
2011,味道不错！实在实惠！不足之处就是大麦茶茶香不够，另外店面面积有点小，坐得有点儿拥挤。另外，我要的是石锅饭，看图片上是有碗小汤的，但吃的时候却没有给汤我，估计是漏了。这点得注意，否则难以让人回头光顾哦。,Not Mentioned,Not Mentioned,Positive,Negative,Positive
2019,这家店所在的二楼油烟味很重，可能是厨房的排风出了问题。鸡汤味道很好，鸡里包的糯米略咸。要提前预约哦,Not Mentioned,Not Mentioned,Not Mentioned,Negative,Positive
2021,米饭五块确实有点贵 鸡汤不错 牛尾汤带了一碗米饭,Not Mentioned,Not Mentioned,Negative,Not Mentioned,Positive
2022,味道变了，竟然吃出了排骨汤的味道。再也不去了,Not Mentioned,Not Mentioned,Not Mentioned,Not Mentioned,Negative
2027,米饭好贵 5元一小碗 不过汤的味道还是很赞的 很合适哦,Not Mentioned,Not Mentioned,Negative,Not Mentioned,Neutral
2038,一听说是团购，态度就立刻180度转弯，手一指就把我们安排在一个角落里。刚进门的热情劲全无。,Not Mentioned,Negative,Neutral,Not Mentioned,Not Mentioned
2043,很好吃，就是打包都没给带调料、希望下次不要忘了,Not Mentioned,Negative,Not Mentioned,Not Mentioned,Positive
2044,才明白   那些评价都是伪造的   根本吃不饱不说   米饭都不配的     5元一份     真心不会再去了,Not Mentioned,Not Mentioned,Negative,Not Mentioned,Negative
2049,口味一般，态度不大好，环境一般,Not Mentioned,Negative,Not Mentioned,Neutral,Neutral
2051,做不起团购就不要做，别到时候给客人脸子看。有点气愤，服务态度很差，来了都没有人招呼，5份参鸡汤就给了4小盘泡菜，一盘一口就吃掉的量，5个人坐那看半天不敢轻易动筷，再要人家半天磨磨蹭蹭不愿给，给的时候说“这是最后一次给，我们都是赔本的”。。早知道我们一个人预约一桌了，这样同样的东西照样得给5次。。给弄得我们像乞丐一样，心情不爽，味道一般吧，鸡都没熟，没敢给孩子吃，孩纸饿着回来的，再不会去了。,Not Mentioned,Negative,Not Mentioned,Not Mentioned,Negative
2052,汤没啥鲜味，肉特柴，糯米少，有小参。小菜不错。态度特别差，十分的嚣张，说不吃就退了呗。预定的时候可不情愿了，但是可以理解嘛，毕竟是少赚了不少，就像我们没给钱，上杆子去他家一样。应该不会再去他家吃参鸡汤了。,Not Mentioned,Negative,Not Mentioned,Not Mentioned,Neutral
2054,味道与环境都非常好，就是服务员有点少，每次需要服务都很长时间才有人答应,Not Mentioned,Negative,Not Mentioned,Positive,Positive
2057,这个 店 非常的不好 应该倒闭。服务的态度 很差。对 团购的不好 不给 小菜 还说脏话。为什么 美团 会和他们合作。 说是美团 出错了。让我自己和美团 解决。反正 这么 久了 还记忆犹新  太讨厌这个 餐厅了 全都不好,Not Mentioned,Negative,Neutral,Not Mentioned,Not Mentioned
2061,对待团购客人待搭不理的，差别对待让人很不舒服，好像是吃多大亏似的，熟不知一多半客人是因为团购才带去，搞不起就别搞，这样{什么？,Not Mentioned,Negative,Neutral,Not Mentioned,Not Mentioned
2062,团购6 7次了很满意的，值得去哦，就是给小菜非常抠门，去了5个人给了4碟灰常小的小菜，让加还很不情愿。,Not Mentioned,Negative,Neutral,Not Mentioned,Negative
2065,没有以前韩国老板娘在的时候好吃，汤锅味道不纯正，没法跟之前比啊！服务员态度冷淡,Not Mentioned,Negative,Not Mentioned,Not Mentioned,Neutral
2066,环境还可以，服务态度不怎么好，说是赠小菜，结果没有，味道一般,Not Mentioned,Negative,Not Mentioned,Positive,Neutral
2067,参鸡汤和脊骨火锅很好吃，味道很不错，但是就是预订的时候服务员态度不好，很不耐烦，但是东西还是很不错的,Not Mentioned,Negative,Not Mentioned,Not Mentioned,Positive
2075,口味还可以 服务真心不咋地 因为是美团安排个很偏得角落 能吹着空调的地方说什么是给人留得。当时才那么几个客人。店家很小农意识。建议撤掉美团推荐店得牌子。,Not Mentioned,Negative,Not Mentioned,Not Mentioned,Positive
2077,味道一般～服务差～爱搭不理～无感～不会再光顾,Not Mentioned,Negative,Not Mentioned,Not Mentioned,Neutral
2079,点的石锅拌饭，量少得可怜，喂猫呢？！,Not Mentioned,Not Mentioned,Not Mentioned,Not Mentioned,Negative
2082,不到20一份参鸡汤，超级划算，味道不错，已经去了几次了，只要有团购，还打算继续去。鸡汤味道很鲜美，就是中午人多，稍微有些吵。,Not Mentioned,Not Mentioned,Positive,Negative,Positive
2088,服务态度很垃圾，要求提前电话预约，这个可以理解，但是，***，打电话没人接，去了之后不让用团购券，那还做毛团购啊，服务员解释电话没人接是因为电话不大好用，***这是理由吗？这种服务态度的店只能说是垃圾，老板要不提高服务员素质，早晚得***关门！,Not Mentioned,Negative,Negative,Not Mentioned,Not Mentioned
2089,是看到各种好评才去的，结果太令我失望了，实在不能昧着良心说好吃，这个脊骨火锅跟我原来去过的韩国店比做的差远了,Not Mentioned,Not Mentioned,Not Mentioned,Not Mentioned,Negative
2091,口味一般，热，没窗户，空气不好，饭里还有头发,Not Mentioned,Not Mentioned,Not Mentioned,Negative,Neutral
2094,参鸡汤里的鸡发黑，而且有厚厚的一层恶心物质，要求更换，过几分钟上来的是退掉的那份。,Not Mentioned,Neutral,Not Mentioned,Negative,Negative
2097,这种店不会再去。像他家种服务搞不起团购就不要搞呗，得不偿失。,Not Mentioned,Negative,Negative,Not Mentioned,Not Mentioned
2098,我严重怀疑上面的是托，服务员一点也不热情，就一个白发老头还挺热情的。,Not Mentioned,Negative,Not Mentioned,Not Mentioned,Not Mentioned
2099,很好吃 大梁骨肉很多 俩人吃绝对够。不过 团购本身不带主食 米饭要5块一碗 建议团购冷面 石锅饭。,Not Mentioned,Not Mentioned,Negative,Not Mentioned,Positive
2106,整体很满意。口味非常正宗，量也很多，根本吃不完。但是有点遗憾的是多点了一份米饭要5元钱，觉得有点贵，其他都不错。,Not Mentioned,Not Mentioned,Negative,Not Mentioned,Positive
2109,东西分量超足，一个人吃有点撑，但是味道超好吃，鸡汤清淡爽口，糯米软烂鲜香，真是不错，小菜的萝卜块很好吃，还免费添加，美中不足就是地方太小了~~~,Not Mentioned,Not Mentioned,Not Mentioned,Negative,Positive
2114,吃过了很多韩国店的冷面、它家的冷面真的太一搬、不好吃！,Not Mentioned,Not Mentioned,Not Mentioned,Not Mentioned,Negative
2117,"环境还可以,就是空调不够给力,吃得很热。食材不是特别新鲜,不过这个价格还好啦,味道不错。个别服务员的态度可真是不怎么样,好像我们欠她钱似的。总体评价还可以吧。",Not Mentioned,Negative,Neutral,Positive,Positive
2118,参鸡挺好吃的、环境不咋地，太热了！,Not Mentioned,Not Mentioned,Not Mentioned,Negative,Positive
2119,团购的很实惠，不过菜量挺小的，冷面也不是很好吃,Not Mentioned,Not Mentioned,Positive,Not Mentioned,Negative
2121,双人座真不敢恭维，很影响食欲，建议大家订座时说自己是三个人,Not Mentioned,Not Mentioned,Not Mentioned,Negative,Not Mentioned
2122,味道一般般吧 选的大酱汤 团购价格还比较实惠的 原价不愿意去的 服务态度不敢恭维 不要小菜都不给上 团购过旁边一家店的 不知道是不是一家的 服务和口味不如那家,Not Mentioned,Negative,Positive,Not Mentioned,Neutral
2126,"第二次来了,服务态度真的不是很好",Not Mentioned,Negative,Not Mentioned,Not Mentioned,Not Mentioned
2128,味道好  环境好  超值 还会再去  对于服务不满意 服务员势利眼！ 对于中国客人和国外客人的待遇很不满意,Not Mentioned,Negative,Not Mentioned,Positive,Positive
2137,略少，小贵，如果不是团购就不是一般潘磕芙邮艿牧恕！！,Not Mentioned,Not Mentioned,Negative,Not Mentioned,Negative
2164,一般肉不好吃米饭太贵,Not Mentioned,Not Mentioned,Negative,Not Mentioned,Negative
2171,我感觉没有以前的味道了！,Not Mentioned,Not Mentioned,Not Mentioned,Not Mentioned,Negative
2180,量大不如前,Not Mentioned,Not Mentioned,Not Mentioned,Not Mentioned,Negative
2203,服务态度不好,Not Mentioned,Negative,Not Mentioned,Not Mentioned,Not Mentioned
2222,特别好吃就是预约电话不好打,Not Mentioned,Negative,Not Mentioned,Not Mentioned,Positive
2240,服务差劲,Not Mentioned,Negative,Not Mentioned,Not Mentioned,Not Mentioned
2254,中午去的，人非常多，排队等待，非常值得等。环境也不错，非常韩式，有炕和炕桌！好像看到几个韩国的人来吃饭，应该是口味很正宗吧！赠送的韩国小菜也非常美味。参鸡汤需要自己调味，真的看到一小部分参。美中不足晚上没有，而且周日也不营业！,Not Mentioned,Negative,Not Mentioned,Positive,Positive
2259,一般，收银台那个女的服务态度特别差，没有耐心，尖酸刻薄。她是摆出一副老板的架子，在店里吆五喝六！但是我记得老板是个老头。下次不会再去了，脊骨火锅里面有虫子，还说是后来自己飞进去的。骗子，再也不会去。,Not Mentioned,Negative,Not Mentioned,Negative,Not Mentioned
2265,服务阿姨一脸萌比的听我俩点餐，没有点土豆沙拉，莫名其妙的出现在了饭桌上…不明所以的吃掉了…我很好奇阿姨是前一天晚上看奥运和继科欧巴一样犯了瞌睡症是嘛??没办法这样吧,Not Mentioned,Negative,Not Mentioned,Not Mentioned,Not Mentioned
2271,连个空调都没有哦 服务一般 菜品一般,Not Mentioned,Neutral,Not Mentioned,Negative,Neutral
2278,"非常非常好，就是贵但是人不算多吃着听你舒服的我
",Not Mentioned,Not Mentioned,Negative,Not Mentioned,Not Mentioned
2290,感觉味道一般般抱着很大的期望去的，吃的挺失望的，里面的糯米根本就没熟、总感觉吃出一股豆腐脑炒大葱的味道,Not Mentioned,Not Mentioned,Not Mentioned,Not Mentioned,Negative
2302,鸡汤飘油花需要改进！不催不给空调需要改进！服务员板着脸需要改进！,Not Mentioned,Negative,Not Mentioned,Not Mentioned,Not Mentioned
2321,位置比较好找，味道一般，确实不知道为什么评论里那么多人都说好，可能我吃过别人家的，对比后真心觉得一般，量也不是特别大，参鸡汤上来的时候我妈说这是童子**。脊骨火锅感觉不出来哪里特别好。但是我觉得拌饭不错。拌饭不用团购，到店吃就是15元。脊骨火锅要是不团购到店吃是100元。整体服务还不错,Positive,Positive,Negative,Not Mentioned,Neutral
2323,位置还算好找，在二楼，不需要排队，味道可以，两个人吃足够了，肉挺软的，用筷子一拉就下来了，有点了米饭，就是米饭价格有点贵，5元一碗，赠送四个小菜，味道可以，还有大麦茶，但是他家周日休息，很奇怪，请大家注意了……,Positive,Positive,Negative,Not Mentioned,Positive
2325,菜的量实在是太少了，估计也不够新鲜。,Not Mentioned,Not Mentioned,Not Mentioned,Not Mentioned,Negative
2329,首尔宫廷在大连算是比较好吃的一家韩国餐厅，比较正宗，最推荐的还是他们家的脊骨锅，每次去必点，小锅可以够2――3个人食用，但是他家的米饭真的是不值得，一碗五块钱，真的是不划算。他家的参鸡汤和炒年糕也是可以的。推荐！#脊骨火锅（小）#,Not Mentioned,Not Mentioned,Negative,Not Mentioned,Positive
2330,一如既往的美味，但是榻榻米的地方没有空调，我们六个人挤在一起，因为去的晚电风扇也吹不到我们，整个吃的过程很煎熬，555……,Not Mentioned,Not Mentioned,Not Mentioned,Negative,Positive
2333,一点不好吃，好不容易开车过去了，吃的太差，还热的不行,Not Mentioned,Not Mentioned,Not Mentioned,Not Mentioned,Negative
2338,中午去的，人太多。服务员面无表情，应该是因为团购吧。味道还可以。因为团购，所以去。,Not Mentioned,Negative,Neutral,Not Mentioned,Positive
2347,味道不错，就是位置不太好找，最重要的一点是没有空调，太热了,Negative,Not Mentioned,Not Mentioned,Negative,Positive
2348,参鸡汤口味偏淡，不过我喜欢清单的，地方不是很好找，找了半天。,Negative,Not Mentioned,Not Mentioned,Not Mentioned,Neutral
2350,爸爸妈妈正好在港湾桥那边办事，我就团了两份让爸爸妈妈去，老两口点的牛肉饭，爸爸吃到一半居然在碗里发现一根刷碗的钢丝球的钢丝，太可气了，店家上饭菜的时候不仔细检查么？？？？？爸爸牙不是很好，把牙整坏了怎么办，发现后店家也没有任何解释和道歉！！！,Not Mentioned,Negative,Neutral,Negative,Not Mentioned
2352,服务员态度差，口味一般，不会去了,Not Mentioned,Negative,Not Mentioned,Not Mentioned,Neutral
2362,挺好的。就是涨价啦 ，我记得第一次吃19……哈哈,Not Mentioned,Not Mentioned,Negative,Not Mentioned,Not Mentioned
2364,我个人感觉来这种地方吃饭得和志趣相投的人来才行，要不吃个饭真累，也不吃不出味道,Not Mentioned,Not Mentioned,Not Mentioned,Not Mentioned,Negative
2373,汤还可以，鸡太小了，普通米饭5块钱一小碗，太贵了，服务员态度不怎么样，要了一碗米饭5块钱，给了10块，走的时候没找钱，可是我们都走到门口也没喊回来说钱没找！,Not Mentioned,Negative,Negative,Not Mentioned,Negative
2374,"环境好,味道美,就是吧台收银那姑娘态度好差呢!",Not Mentioned,Negative,Not Mentioned,Positive,Positive
2375,经常去的韩餐店之一，环境，服务都挺好的，，可以最近参鸡汤涨价了。,Not Mentioned,Positive,Negative,Positive,Not Mentioned
2389,还不错。米饭5块钱一碗好贵，其他都不错,Not Mentioned,Not Mentioned,Negative,Not Mentioned,Positive
2393,不好，吃出不干净的东西，商家也没有好的态度，而且去吃个饭从头到尾都没看到服务员有个笑脸，请问你家服务员是不是都刚失恋？桑桑个脸，再也不会去了！,Not Mentioned,Negative,Not Mentioned,Negative,Not Mentioned
2405,味道很是不错！鸡肚子里塞的满满的糯米，非常香！服务生也十分热情，原本团的并不十分划算，她主动告诉我这样做，是个好女孩,Not Mentioned,Positive,Negative,Not Mentioned,Positive
2416,不太喜欢，服务态度也不好，第一次吃，感觉好恶心,Not Mentioned,Negative,Not Mentioned,Not Mentioned,Negative
