ID,reviews,location,service,price,environment,dish
2418,位置有一点点不太好找，在大厦里，一开始按照地图找结果绕着大厦走了一圈。店面不大，但是东西味道还不错。参鸡汤清淡可口，拌饭味道也不错。单点了一份土豆饼，3块25元有丢丢贵。服务还算周到，就是屋内有点串烟，整体感觉还不错，美团券确实实惠，有机会大概还会光顾。,Negative,Positive,Neutral,Neutral,Positive
2421,一如既往的好吃，但是真是这四年看着参鸡汤一直在涨价呀??希望不要再涨了吧。还有新的服务员态度有点急躁。,Not Mentioned,Negative,Negative,Not Mentioned,Positive
2430,感觉太一般了，去了服务员特别不好，明明店里还不是吃饭点，都是空桌子，还不让我们随便选，我想坐宽敞一点的，然后说都是留台的什么的，我就忍了，后来有一对老夫妻来也被安排，说想坐别的地方，然后不让，老头来脾气就领老伴走了，服务员还说不吃拉倒，之后来的人就想坐哪都行，这回也不说是留台了，菜味道超级一般，然后体验了最坏的服务员服务、真是够了，再也不想去了,Not Mentioned,Negative,Not Mentioned,Not Mentioned,Neutral
2435,味道很好 鸡肉很嫩 就是味道有点淡 不过好在他家小菜很好吃！4种小菜刚好配着参鸡汤味道才刚刚好 不过貌似不管几个人都是这些小菜 所以 人多吃就不够啦！中午人很多 的自己找位置 服务员不管的 坐好也没人点菜 得喊才行！,Not Mentioned,Negative,Not Mentioned,Not Mentioned,Positive
2439,好吃好好吃吃好吃。就是地方很热…,Not Mentioned,Not Mentioned,Not Mentioned,Negative,Positive
2449,挺好的量也很高，但是真的是太热太热了，而且通风不是特别好，店内也有其他，饿再吃其他的东西如果你稍微呆一会儿的话，身上就会有味道。,Not Mentioned,Not Mentioned,Not Mentioned,Negative,Positive
2454,好吃，就是找不到路的时候服务员态度不太耐烦。他们家搬出来了，在良运大酒店对面的小路往前走一点的小角落里,Negative,Negative,Not Mentioned,Not Mentioned,Positive
2457,和朋友第一次去，这个难找，最后打电话才各种找到，味道可以，就是没告诉我们盐在一旁，一点滋味没有，挺烂乎的！去的时候没有人，还可以，还把眼镜落在店里了，希望下次去能吃到有盐调味的鸡汤，老板挺和谐的，下次再去！#参鸡汤# ,Negative,Neutral,Not Mentioned,Not Mentioned,Positive
2461,换了新地址，不知道为什么味道差太多,Not Mentioned,Not Mentioned,Not Mentioned,Not Mentioned,Negative
2472,服务很好，菜量不多，中午的优惠套餐真是越来越贵了,Not Mentioned,Positive,Negative,Not Mentioned,Negative
2477,上午一直很馋炸鸡，中午就选了附近评价比较高的这家，来的比较早，人不多，服务员让我坐在紧贴在冰箱的缝隙里，又挤又热，我坐在了过道。才过十一点，服务员却告知没有炸鸡了，无奈只能换成猪肉，一盘子甜兮兮的肉真的很难吃，根本没吃几口，屋里似乎没开空调，热的发闷，所以大酱汤根本喝不进去，感觉是在桑拿房里喝热汤。这时旁边一个不是美团的顾客点了炸鸡，服务员说马上去炸……不知道为什么美团的就不能马上炸……所以最后是花三十五块钱吃赠送小菜和米饭吃个半饱。真的不明白为什么网评这么好，自认为不是挑剔的人，都是良心话，真的很失望。不会再来，希望卖家负点责任。,Not Mentioned,Neutral,Neutral,Negative,Negative
2481,一直总来，可是这次好失望，生菜简直不知道什么时候的了，太不新鲜了，，上面好多黑的。还有店庆五折的烤肉，。。虽然25块钱，已经半价，但是真的量也是一半的好么。。。就那么几片好少好少呀。。。一个人吃这俩很饱了，主要是去喝汤的。,Not Mentioned,Not Mentioned,Positive,Not Mentioned,Negative
2484,"鸡一看就不是很新鲜，国人吃的可以,可是我老公(韩国人)吃特别不满意，就感觉打发凑合人似的。",Not Mentioned,Not Mentioned,Not Mentioned,Not Mentioned,Negative
2485,第一次喝鸡汤。好不容易找到地方的。鸡里面有米饭。不用单点米饭5元。撑死我了。,Negative,Not Mentioned,Neutral,Not Mentioned,Positive
2496,感觉是我团购里面比较不理想的一家吧。,Not Mentioned,Not Mentioned,Negative,Not Mentioned,Not Mentioned
2497,位置在港湾一号里吗，临街没有明显招牌。楼里好多韩餐。点了冷面，鸡汤，春卷，芝士年糕，炸酱面。鸡汤，炸酱面还好，春卷和年糕味道不错，冷面不好吃，韩正园是标杆。收银长的挺美，态度相当次，美团结账问了下能不能同时用两种券，非常不耐烦，不，耐，烦!,Not Mentioned,Negative,Neutral,Not Mentioned,Neutral
2535,东西不太好吃，都没吃几口，也许不太喜欢这样的口味,Not Mentioned,Not Mentioned,Not Mentioned,Not Mentioned,Negative
2544,越来越难吃了 不好吃 不好吃 不好吃,Not Mentioned,Not Mentioned,Not Mentioned,Not Mentioned,Negative
2565,还可以，环境不错，位置挺不好找的,Negative,Not Mentioned,Not Mentioned,Positive,Not Mentioned
2571,参鸡汤不错，大人孩子都能吃。服务稍微差点。。,Not Mentioned,Negative,Not Mentioned,Not Mentioned,Positive
2612,不怎么样…鸡肉不怎么新鲜，有点时间长的坏味…,Not Mentioned,Not Mentioned,Not Mentioned,Not Mentioned,Negative
2614,辣白菜五花肉不错，其他的都很一般，不推荐,Not Mentioned,Not Mentioned,Not Mentioned,Not Mentioned,Negative
2623,价钱比以前高了啊。。。不过还是喜欢吃。,Not Mentioned,Not Mentioned,Negative,Not Mentioned,Positive
2629,菜品都不错，唯一有个细节希望店家考虑一下，就是在饭口时间，大门一敞开，坐在门边的几桌会被风吹得特别冷，尤其饭菜，不等吃完就都凉了。,Not Mentioned,Not Mentioned,Not Mentioned,Negative,Positive
2632,很棒，早些到就无需等位，到了12点基本就满位了。需要指出的是厨房的油烟味太大，菜单一多，大堂里都是油烟味。,Not Mentioned,Positive,Not Mentioned,Negative,Not Mentioned
2634,味道很正宗，就是有些简陋，小菜越来越少，环境也一般,Not Mentioned,Not Mentioned,Not Mentioned,Negative,Positive
2651,味道依旧，坏境都一样，不排队，还是美团之后划算，不团购不值得买，就是吃完了衣服上全是味道，排气不好吧,Not Mentioned,Positive,Negative,Negative,Neutral
2652,港湾广场里面人最多的店了，地理位置不好可是味道好啊…不过服务应该加强哦,Neutral,Negative,Not Mentioned,Not Mentioned,Positive
2665,不好 口味差 小菜不干净 以后不去了,Not Mentioned,Not Mentioned,Not Mentioned,Negative,Negative
2674,套用团友的一句话，不团购真心不值得去，30元一碗的牛肉饭，唉，太太太一般。,Not Mentioned,Not Mentioned,Negative,Not Mentioned,Neutral
2701,其实味道还可以、就是太辣太辣了……而且锅的价位也不是很便宜、吃点简餐还可以。环境也还可以。去的时候是饭店 所以最近的工作的有不少在那吃 大酱汤什么的、还是要强调 太辣太辣太辣了。最后没吃几口打包了、 但是到最后也是没逃过扔的命运。而且量也不多的。,Not Mentioned,Not Mentioned,Negative,Positive,Neutral
2761,喝参鸡汤必然来这里。不过就是周围没有停车的地儿，不太方便。,Negative,Negative,Not Mentioned,Not Mentioned,Not Mentioned
2763,口味非常正宗，本人是延边人。觉得这家做的味道真的很正宗，就是服务态度不是很热情。其次环境也很还原，就是满屋子的油烟味和乱七八糟的味道，建议该换个好点的吸油烟机或者别的设备。其他真的很满意,Not Mentioned,Negative,Not Mentioned,Neutral,Positive
2779,价格比原先贵了，鸡大了，口味还是那么好吃,Not Mentioned,Not Mentioned,Negative,Not Mentioned,Positive
2782,和朋友来过很多次，米饭有点贵，汤品很好,Not Mentioned,Not Mentioned,Negative,Not Mentioned,Positive
2793,2人吃量足够还行，又另外要个海鲜饼挺好吃的，晚上刚营业去的，人不多、环境还行，但油烟排不出去味道太大，还没有停车地方。,Not Mentioned,Negative,Not Mentioned,Positive,Positive
2823,这个参鸡汤汤的味道不错，但鸡肚子里面的米饭呐真心不好吃。好难吃,Not Mentioned,Not Mentioned,Not Mentioned,Not Mentioned,Negative
2840,牛肉饭少了，参鸡汤很好一整只鸡，冷面也少的可怜……,Not Mentioned,Not Mentioned,Not Mentioned,Not Mentioned,Negative
2841,量非常小，很难吃饱。口味一般般,Not Mentioned,Not Mentioned,Not Mentioned,Not Mentioned,Negative
2846,服务不好，参鸡汤不够鲜！其实一个人点一份鲜鸡汤完全够了，再点其他的就是浪费，服务员也没说清楚里面是鸡包饭完全够一个人吃了，还有四碟小菜。,Not Mentioned,Negative,Not Mentioned,Not Mentioned,Neutral
2849,辣白菜炒饭，不知道为什么这次的非常辣，无法接受，没吃几口,Not Mentioned,Not Mentioned,Not Mentioned,Not Mentioned,Negative
2852,还可以，东西小贵，美团很合适。,Not Mentioned,Not Mentioned,Negative,Not Mentioned,Positive
2857,很好吃，就是量有点少，吃不饱，服务很好！,Not Mentioned,Positive,Not Mentioned,Not Mentioned,Negative
2880,店内稍微有点儿冷，空调好像不给力呢~,Not Mentioned,Not Mentioned,Not Mentioned,Negative,Not Mentioned
2899,服务有点乱。味道不错。免费的小菜很好吃。还会再去的,Not Mentioned,Negative,Not Mentioned,Not Mentioned,Positive
2905,不可以，就是上菜慢，服务员看不到人。,Not Mentioned,Negative,Not Mentioned,Not Mentioned,Not Mentioned
2921,团购的鸡汤牛尾汤。值！汤很好喝营养高。又额外点了份土豆饼。可上的却是土豆泥。不知是上错了还是就这样。除了土豆饼不推荐。都很好。环境好。坐在炕上暖暖的。周日休息哦。可不要来。,Not Mentioned,Not Mentioned,Positive,Positive,Negative
2958,环境差了些，人比较多，参鸡汤和石锅拌饭好吃,Not Mentioned,Not Mentioned,Not Mentioned,Negative,Positive
