海鲜都坏啦,样式少,空间也小第一次去都没怎么吃,总之不满意
放蘸料的碗弄的也特别小,吃着特别难受,两人的桌子太小了,现在就给个小鲍鱼
下回希望,或者锅底给换换水,下回不敢再吃海鲜自助餐了,最后吃完锅里的水超级超级脏,店家可以清洗再干净点么
觉得不如以前好了,而且去吃那天都没开空调太热了根本吃不下去了
就是人太多了
后来就没怎么吃,海鲜里面都是沙子
而且觉得菜品也不如原来了,这次真是热死了要,连个空调都不开大一点,这次是最糟糕的,怎么吃火锅?问服务员居然说调不了
没皮皮虾,没螃蟹,但菜品较少
服务员说等2分钟,结果用了一个小时
就是不太干净,都是沙子
菜品太少
不新鲜,地方也不是很大,种类少
味道也一般般,一点新意都没有啊,结果看我们人多就给我们一个锅,不知道放了多久的,好多菜都干巴巴的,本来以为一人一个小火锅
海鲜很多种都不太新鲜,别的自助种类也很少,非常差的一次自助,真的差的很远,种类少
大家在这样封闭的地方吃饭,空调希望能开大些
而且肉也不是新鲜的,菜品少
海鲜里都是沙子,根本没法吃,上吐下泻
海鲜有的是臭的,火锅汤也不好吃一般般吧
回大连特意去吃了一回,空调温度有点儿高,性价比不是一般的高哇
虾上的速度很慢,品种一般,去晚了很多东西就不上了
还不礼貌,那个前台接待就是个骗子,真心服了,连句人话都不会说
就是空调太不给力,上卫生间也不方便
有点吵
价钱小贵,产品稀少啊,吃点海鲜还凑合
环境差,真心不咋地,真不知道那些好评是哪来的,不咋推荐,全是岘子,菜品太少,样式不全,是我吃过最难吃的了
让加汤等半天也没加,这个到8:30就结束了,说什么就跟没听见一样,而且这个佳兆业店服务员态度极其不好
根本没啥海鲜,菜品不全,服务员态度差
空调开的不好,太热了,吃了几口火锅就不想吃了,只能吃水果
就是安排的地方没有空调,热啊
地方有点小
服务员收拾桌子太慢,店里闷热,空气不流通,环境一般般
而且里面全是沙子,海鲜基本都是贝壳类的,全是沙,回家就开始腹泻
味道凑合吧,感觉没有原来好了,卫生也比较差
到店门口顺口问了一下一个男服务生,美团明明写着免预约,然后往里看好多人拿着验证码都没预定,没正常的那么硬
人一多感觉服务员不够用
差评,座位选择上一点不任性化
等了很久才进去
就是这次服务员态度好差,吃的没什么可说的
太热了,好像没有空调一样,下次有待考虑
海鲜也不那么新鲜,服务就不好了,还有沙子
再有缺少一些热菜,感觉菜品种类稍微欠缺一点
拍了两个小时的队,海鲜都臭了啊
真是没什么好吃的,没有什么海鲜
还特别小,人特多
服务没有办法不让我吐槽,简直没法说,味道也一般,我是外地人
只是太小
鲍鱼居然是活的,出来时候两点半多居然还有在外面等号的
就是空调效果不行
只是觉得环境太闹,就这个价格来说
就是处理得不太干净有些螺沙子挺多
味道很不好,给的两个鲍鱼其中有一个坏了
以后再也不去了,没什么好吃的,真的超难吃
人较多
结果去了没有
服务员差
服务偏差
海鲜沙子太多,菜样不多
就是好多螺和贝壳没太洗干净,有些泥沙
这次又去发现菜品和以前差太多太多,不满意
有一些煮完沙子比较多,螃蟹限量没有龙虾,只是海鲜品种少了点
一般,还那么小,我建议大家吃鼎香缘还是去兴工街的吧
樱桃10块钱3斤么那么酸,也就肉还好把,差评以后不去了,吃个海螺一股苦味
就是曾的螃蟹不好,小不说还不能吃扒开一个看坏了
服务超级差
螃蟹实在和鲍鱼实在是有些小
就是服务员盘子收的太慢
蚬子敢不敢上点新鲜的,鱿鱼噶不噶使不带汤,虾能不能不是半截的,说好的蟹子呢
一切不都解决了,这不浪费原材料嘛,多拿清水泡一会,关键贝壳类的里面咋都有沙子啊
不好吃,但是感觉东西不太新鲜,环境还凑合
不咋地,菜都是凉的,海鲜不新鲜
就是空调不行,太热了
前台收款服务员态度特别不好,再也不去了,而且对顾客有区别,不好
贝壳类内有泥沙
服务员极少,没几个人在里面吃饭,菜品不新鲜,感觉要黄了
蓝莓山药,螃蟹有点太袖珍了
人家在哪吃饭,她在哪卡痰,服务员太恶心了,注意一下形象好吗
哪有那么过生日的,但是有一点不太满意,真是太不会变通了,谁的身份证不都是阴历生日
空了好多位置却给我安排了一个犄角旮旯,找经理经理也爱答不理,服务也差,还没有空调,位置偏也就算了,打死也不想再去了
结果他来句吃点别的就好了,海鲜有臭的,这次是真的太差了,护心肉和肉卷也坏了
然后就是那个螃蟹太小,螃蟹不好应该也正常
一股子臭味,小海鲜是真小啊,煮完海鲜闻着锅里面冒出来的气
不怎么新鲜坏肚子啊怎么办啊,肚子疼
就是海星太难吃了
虾滑,羊肉,海鲜不新鲜,不过服务人员态度不好
就是挤了点
差评,到里面说没有位置了,全大连最差
吃的太垃圾了,出来准备在吃一顿,贝类不新鲜发臭
排完八点多了
海鲜自助,无活海鲜且样数特少
但是一点都不好吃,但是烤肉师傅和煮饺子师傅,一点烤肉,都没有
服务缺点什么的不存在的
没下次了也,都不带正眼看你一眼的,海鲜也不新鲜,服务员那态度啥也不说了
室内有一个空调还是故障的,环境有点热,就是空调有点热
螃蟹也很小,菜品就一般般了,就是个头小一些,螃蟹不新鲜
真的太难吃了现在还想吐吐吐
菜品那么少,店里连个厕所都没有,什么啊
就是不开空调,太热了
不小心拿多了,吃的着急
蘸料不咋样,不好吃,黏糊糊的
就是门口管排队的大姐态度有些不好,还点排队
这鲍鱼在小点可以当硬币你花了,这螃蟹你是在海边捡的吗,吃的腻的慌,赶不上以前了,能在小点吗
希望能够改进,海鲜不新鲜,贝壳类沙子比较多
海鲜避免不了吃出沙子
口味总体一般,沙子比较多,海鲜比较少
结果差了太多,真的无法给好评,海鲜没有什么,以为和福佳新天地的一样,菜样也少的可怜
以后也不会去他家光临,说了不新鲜怕吃坏肚子还是要扣你押金,所以不停的喝水,五花肉很不新鲜很腻大虾都臭了,调料特别咸
晚场如果不那么多的人就好了
海鲜有好多都不新鲜
排队排了半小时,但偶尔吃到沙子
感觉不会再去了,说是海鲜自助但是根本就享受不到海鲜的感觉,我只能说很一般,菜品水果甜点都不怎么新鲜
有点贵了,人多了就吵了
都没人了,就不叫我们三个人的,他们排号安排的不公平,太不公平高了
一点升级都没有,就是排队很烦躁,要不然都被别的自助餐比下去了,还是原来的样子
岂不是最好的选择呢
品种少和兴工街新天地店差的太多,就是菜不新鲜
都是涮锅,东西也不全,就是佳兆业店铺太小了,没有烤肉
我觉得挺一般的,菜不是很好吃
地方比较小,显得乱,菜品不是很多,反正一般吧
满厅的空位选了个说啥不让坐,说只能坐到最里面的角落里,地域歧视,妈的
现在也没有了,东西太少
空调太少
又贵又没东西,东西差太多了,跟高新园区的比
蛋糕不好吃
就是有点吵,自助应该都这样吧
就是人太多
太热了,没有蟹子,不喜欢不喜欢
没想到现在成这样子,以前不这样的,就是服务不太到位
以为会很好但是很一般而且排队好久有一个点了非常不喜欢
还是死的,就是螃蟹太小了
给的鲍鱼居然只有指甲盖大真心不满意呀,可是菜的种类实在太少,说的是自助
以后不会再去了佳兆业店,服务态度不好,海螺没有,说好的南美烤肉没有,菜品欺骗顾客,螃蟹一人就一个还是小的死的环境卫生,海鲜素菜服务员都是直接上手抓的总之
太,了,差,真
就是北极虾上的比较慢
就是服务意识比较差,隔壁桌因为服务员的原因都索性不吃离开了
环境也很一般,锅底也很难吃,反正下次不会再去了,态度也很一般,东西挺一般的
个别服务员的服务态度有待提高,69元团购的,可是门店价也是69
热死了,就是空调开的太小了,吃火锅热坏了
团购退的还麻烦,就是等了太苦逼了团购63,不如现场抉择呢
肉还可以,贝壳牙碜,不太干净
等了一个小时,人太多了
我就吃了点菜肉的质量太差了太硬口感不好沾料也不好吃服务还行
排了两三个小时左右才吃上,贝壳类不是新鲜的,而且海鲜都是廉价类的,那是已经没什么菜了
服务也不好,螃蟹跟鲍鱼还每人一个,没感觉多好,垃圾满了也不知道给倒
螃蟹很小
不自在,都盯着你看
就是空间有点小
菜品倒是还不错,我只能说热死了,五月份了
菜多人多,在驾照也也算是人最多的了吧,实在太小了放不下几个盘子
之前问了才来的说海鲜都是活的到了之后才知道只是一部分吧鲍鱼和螃蟹一人一只太少了菜品样数再多点会更好
屋子里热死了,下回不回去了,简直待不下去,菜也不全
找都找不到,热的像洗浴中心不开空调,调料好咸一般般
麻辣鸭头处理的不是太干净
排队排了半小时,人太多,很无语,东西也一般
就是佳兆业的地方不大,太挤了
太热了,没有空调
就是服务态度不怎么好
海鲜没洗干净,味道一般海鲜没洗干净煮过海鲜的汤是黑的虾滑一般蛋糕卖相还好水果不错真不道为什么他家这么多人,味道一般
就是空调不太给力
就是菜品太少了,蟹子肉都面了,给的小飞蟹都空了,希望能下次改进
很迷你
就是地方有点紧张
海鲜类沙子在少点,就更好了
以后可不来了,太次了,希望别人也别去了,连最起码得都没有,啥也没有
可能因为面积小的关系吧,感觉这家品类不如福佳那家全
就是室内太热了,空调开的不够大
人还少,就是排队太麻烦了
环境卫生不太好,服务一般,找不到服务员
超级热,排队排了一个小时,还被分到一个旮旯,人太多了
就是里面太闷了,热啊
大家别去吃了,太恶心了,下回再也不去了,太差劲了
这次去海鲜品不是很新鲜,希望下次改进
人太多,可以吃的东西太少,不推荐,味道太一般了,反正我是不回去第二次的,屋里太热
不好的一点儿就是人太多了,在这吃了两次
一个小时的等待,东西一般般
自认为吃自助不划算,环境不是很好
螃蟹很小
就是地方小了点
但是没有白排
期望太高,失望太大,海鲜不新鲜
菜品没有什么变化,海鲜基本是冰鲜
海虹也臭了,虾滑,螃蟹都臭了,都没有心情吃下去了
鱿鱼还是速冻的,海鲜是真不新鲜
还希望卖家加强对员工培训素质,一排4人位的桌子坐满了都是2个人特别不满意这点,但是刚入门领座的阿姨非给我们安排小的桌子
我们经常去但是收银太慢望改进
再也不敢去了,真是食品安全有问题,以后再也不去了,海鲜菜品各种不新鲜,大人吃完全体拉肚子,前台服务员态度恶劣,吃完都肚子疼的拉了几次,不是惹气去了,我tm是去消费了
就是烧烤让人不满意,好多人去问他也不烤
将近一小时时间,饿的我都不想等了
就说排队时间太长了
人太多,等位子比较慢
来了以后感觉服务还是真的没的说,还有螃蟹也简直连我都不想要了,最后煮完了我都没捞出来,感觉这鲍鱼的个头真的是已经小得不能再小了
其他我觉得都有待改善啊,根本就不一样,不知道这个店里就这样还是什么特殊原因,啥都没有
浪费时间
还没一个人吃的多,俩人都不能吃
煮完了闻着没法吃,大蛤有好多都臭了,吃完回来就腹泻了
连上都不会上,去的是佳兆业点,服务态度不好,跟福佳比差远了,一大堆东西都没有,有的东西上完了
服务,外地人来吃的话
就是人多等的时间长
贝类吃到嘴里都是沙子,一吃就没胃口了,环境很差,海鲜不干净
排了半个小时得队
排号排了一个小时,东西很多,只是人太多了
没到时间食物都被收走了,整体环境拥挤给人感觉不舒服,菜品种类少,通风处理不到位
不知道是不是限量
不建议节假日去,全是烟,这样说明是人家生意火吧,不怎么好
吃的一般,海鲜里有沙子
种类也不是特别的多,地方太小了,这次合计换佳兆业吃一次,有点后悔
味道一般吧
就餐环境真不敢恭维,名不符实,人太多
羊肉
自助不能要啥服务了,就是服务不咋地,没办法
就是螃蟹小了点
就是人太多了啊
想吃的都没吃到,样式太少了,和福佳店比差远了,再也不去了
人太多了
没啥吃头,能吃的还成,螃蟹很小
评价有点晚
排队时间太长了,服务态度不是很满意,都快等出胃病了
这个连披萨毛都没有
就是服务员态度不是很好,空调都不给开,不过还是回去
晚上有点小腹泻,海鲜可能不怎么新鲜,小火锅太小了
一般吧,没有想象中好,团购吗,不怎么样
就是空间有点挤,悲催,今天还遇到断电
位置难找
不是特别干净
就是海螺臭的好多
超级失望的一次团购,不好吃,非常不好吃
排了一个多小时的队,吃到下班才走
所以服务跟不上
位置难找
就是送的鲍鱼螃蟹太小,还有就是海螺有点坏了
很挤的样子,菜品台显的小了,自助餐口味就那样
吃了半天不饱肚,环境太吵闹,排队很难排,海鲜吃着太麻烦
就是糕点难吃,冰淇淋也少了,全变雪糕了
尤其是女的,服务员很凶,服务态度不是很好
菜品己不太齐全了
服务也不好,地方下,东西不好吃
就是钱贵点
东西挺多的就是地方太小
挤
就是地方小了点
这次是服务最差的一次
就是蚬子里沙子有点多
又不是要你身上一块肉,还想干黄别的家呗,服务员啦啦个,再也不去了,金汉斯让你们这群干黄了
拌菜普遍都咸,拿的东西不多
太吵了,就是人太多,有点挤
环境差点
因为我们都是花同样的价钱,要想看个电影吧还得算时间,肉类又很少,饮料不好喝是一直都有的问题,但是跟福佳比差太多了,只有服务还不错,而且营业时间太短了,都差好多
佳兆业种类太少了,螃蟹那么小居然还限,披萨都没有
就是人太多
屋里太闷了,人太多
继续加油就是座位不好
等了半个小时
为什么不开空调呢,火锅吃起来本来就很热,啤酒貌似不是太好的,还没有冷气
位置不太好
菜品没有福佳那边的店全,太拥挤过道很窄
就是我吃的太少了
调节起来不方便不说,都得用纸巾垫着按??总之,这次有点不开心,竟然我的电磁炉是不好用的找来服务人员换了一个备用的竞然调节键在桌子下面吊着的
从进去用餐到出来退押金面无表情,唉,了不得,收银台那女的跟欠她钱似的,高高在上
螃蟹打开几个都是空的,虾也不是活的,海鲜品种特别少,糕点难吃
而且还不给小朋友围裙,海鲜不怎么样样还有煮的海鲜要等吃饭的一半时间了
东西很多,虽然价格涨了
桌子极小,吃一半坏肚子,调料兑水,饮料机时好时坏,酸奶机一直坏的
生鱼片不随便吃,你能吃了吗,真不是滋味
人都起不了床了,海鲜有好的臭的,肚子都吃坏了,拉了两天
但是有一点不好就是收银有点慢,在多几个收银就好了
拉了两天,有死的,海鲜不干净,我们两个人都吃坏肚子了
吧台设置的位置不好,海鲜也不是特别新鲜,20块钱我不高兴在回去退了,一分钱一分货,一般般吧
好久没去了,唉,就是螃蟹有点太小了
可是她们并没有通知我们消费者七点就撤餐啊,可是领位员说是晚八点就不营业了我们是六点去得,难道我们吃饭不花钱吗,也劝消费者慎重考虑,有好多客人对这样得事情很不满
不新鲜,太小,建议螃蟹要么就别上了,倒不如换成鲍鱼
东西少,不好吃,海鲜一般但羊肉还行
最后找了个靠近前台的桌子,只是环境不够好,但是很多桌子不能坐
虾滑很咸,菜品有点少
大连这个价位有点贵,什么都是一般般啦
肉的种类也少很多,海鲜不干净,花同样的价钱居然两店差距那么大,也就只有服务还不错,冰淇凌就一种口味还就剩桶壁上的一点了,环境小,菜品少,真的是不应该啊
只有火锅应该有的东西,没有配菜
第二次去了,蔬菜样式不够多了
海鲜一点都不新鲜,凉菜不好吃饮料全兑水,东西太不好了
地方不大
很多时候都吃不到
大虾也随便吃,吃的菜有些少,有的海鲜好像也不算太新鲜,太小了
小的可怜,站排,鲍鱼和螃蟹不敢恭维
贝类沙子比较多,建议海鲜不要多吃,清理不是很干净
佳兆业的那里种类很少,地方小
总是拉着那张长白山的脸,很是不高兴,就是他家的经理死脑筋
食材没有以前的种类多了尤其是海鲜,有的告诉没有了
还行就是菜上的慢
感觉服务员清理台面的速度有点慢
菜品也没有那个店多,没有福佳大,地方很小,去的佳兆业那个店
特别是吧台服务和发鲍鱼处服务不满意,服务不满意
真的再也不会来,海鲜类别也不多,又难吃,肉只有两种,人还很多
没有熟菜都是凉拼,吃的种类不是很多,送的螃蟹超级小
服务员态度也还可以,臭的,壳类海鲜有坏的
服务员态度一般,蛋糕不好吃,主食太少
东西品种比较少,没有别人家的多,口味也一般
就是人太多
后来不好喝了,很伤心
种类不是太多
吃的一般,鲍鱼小的可怜,蛤蜊都死掉了,人乱死了,饮料没味儿心赛的一顿晚餐
那个管理取螃蟹的人态度不好
菜品太少了真心少
就是部分海鲜不太干净
种类比较少,下次不会再来了,很一般
就是地方小了点
就为了省那点手续费么
螃蟹也不是新鲜的,越来越差,再也不去了,东西越来越差,鲍鱼很小不说,羊肉肯定是假肉
但是有点咸,其他饮品都很一般,虾有点小
人多,吵杂
东西越来越少,没有之前的好,这次去比较失望,海鲜有的也不新鲜
排了半小时队
没有以前好了
菜品很少,一般般啦,地下很远,位置难找
他家那经理不会办事,第二次,很不愉快
空间小
有点小贵
环境在地下,团购就不合适了
螃蟹和鲍鱼那么小还按人头分,我团购还花60多呢,不怎么样,不值得那些钱,一般般吧
螃蟹太少,就是虾少
味道很一般,鲍鱼蟹子都是冻的根本不能吃,蚬子全是沙子没法吃
菜品少的可怜,菜品少的可怜福佳新天地的是一家吧那个店还行这就跟小饭店一样
就是有些海鲜有沙子
而且螃蟹很小
很不满啊,吃的不爽,去的不是时候,没吃一会就把东西都收了
就是扇贝有点小,差点没找到
就觉得都不怎么好,可能是因为沙子的原因
环境有些乱,很久没去了,就是人太多了
真心不好服务态度太差,没有小票押金不给退
虽然价格偏高
服务让人无语,收拾东西像你欠他钱一样
你
菜品少的可怜,一般般
北极虾有点小,螃蟹有点小
菜品更好些,大骨头不太好吃,虾滑味道一般,蚬子没太吐干净有的有沙,服务员服务不太及时
但是环境太乱
除了环境小
稍微有点吵,要是再多点点心之类的就更好了
小鲍鱼每人一个,没有乱七八糟的食物
服务态度超烂,吃完回来就拉肚子,不符合免预约条款,菜品品种少,真的是很不愉快的体验,特别差劲服务态度超烂服务员还很强势菜品品种少,还不新鲜
服务员唧唧渣渣就在旁边讲个不停,里面不知道加了什么东西,但有些感觉不新鲜,总体一般,滑味道特别奇怪,服务一般般感觉没什么划算还不如单点去火锅店
但是没有西安路的样品多,位置不是很大,坐着的位置放衣服的地方都没有
环境一般,服务态度不太好,食物品种有点少
自助的海鲜就是那样吧,感觉下到锅里就不太卫生
服务差,东西少,环境不好,佳兆业店小
以后不会去了,汤里一股味
不过这次去虾被水泡的白了
就是人太多了
服务差,根本不值这个钱,海鲜不新鲜,太差了
海螺还是坏的
服务态度一点都不好跟大爷似的
虾小,服务和环境一般,质量都一般
太不新鲜了,服务差不会在去了,一点不好吃
才到我们,人就是多了点
还每个人多收了十元,团购里怎么没写呢,只是无力吐槽收银员了,无语了
整个锅都黑了,吃不下去了,太不新鲜了,再也没胃口了,找到服务员连个说法都没有
需改进,人多,就是地方太小
去领螃蟹我问螃蟹怎么是死的,菜品不新鲜,品种少,我花钱吃饭不是花钱受气来了,螃蟹是死的,还不新鲜
太贵了东西也不好,总之不好,不满意
品种少
店小,种类少
我想说你们要私吞押金吗,到时间了不来提醒,说超时了,不过服务员很扫兴,你这么做你们老板造吗
海鲜不新鲜,菜品越来越差,以后要考虑不去了
非得等1个小时,这次去也不知道抽什么疯,不让进,唉
蟹子开盖都黑了,就是鲍鱼还是别给了,也算了吧
赶上平安夜送了平安果说是海鲜火锅只有虾可以吃其他全都是沙子超级不喜欢吃小锅换锅后给的是清水
可能是时间的问题
不是很好吃,真的吃不出亮点,北极虾都不新鲜了
佳兆业一半,还有就是海鲜不新鲜
菜品质量很差,海鲜很不新鲜,羊肉是假的
只不过服务态度有待加强啊
桌子上堆满了服务员都不去,实在放不下了就叫服务员,而且海鲜很不干净,很不新鲜,还有就是服务员
服务喊半天才来
海鲜不新鲜有沙子,水果不太好
可能是人太多太辛苦了,之前服务员的态度不太好
门口的提示牌明明写的晚餐16点20开,结果咨询时被告知是16点30,而且态度还不耐烦,还没等吃饭就觉得不舒服
但这次肉碎了很多
而且服务员素质差,跟刚开始差了太多,越做越差,包括领班态度也差,鲍鱼像一元硬币那么大
吃了两次都拉肚子了,可能是不新鲜,以后应该不会再去了
其它一般
还不干净,海鲜不新鲜,建议你们还是去吉尔森,而且也没有什么东西可以吃的
就是价格比以前高了那么一点,要是螃蟹质量再好一点
以后不会去了,海鲜基本都是臭的,味道大不如从前
很失望啊,简直是太不值得了,味道不好,菜品很少,环境不好
东西多,杯子干不干净不知道勉强用吧
人有点多了,就剩一张桌了,地方不是很好不过服务态度还是不错的
地方很小,总之以后肯定不去佳兆业,结果人多转到了佳兆业,结果很失望,咖啡打出来是白开水,坑人
地方环境不好,没人限量一只还60多,吃的东西一般,不值啊,螃蟹坏了
几乎一个小时后才进去的
客心性早就磨没了所以我也不生气只希望餐饮要做好应该去参考一下别人家的既然做了就做好难吃扔了浪费不吃做了也浪费不如做好了全吃掉不浪费还招揽到很多顾客得到好口碑期待加油吧,没有口感蔬菜洗的不干净小菜做的没品质海鲜不新鲜赠送的螃蟹是死的鲍鱼大约是六十头的杯子消毒不彻底服务员把汤汁撒到手机上什么没说就走了自助就是这样吃下来的我也理解每天都要服务人山人海的顾
希望可以改进环境,里面有人吸烟,不喜欢
就是吃的东西太少了
但是服务员态度不怎么好
就是人太多太热了
菜品不是很多,说实话,火锅太小了,不太喜欢这家,一般般吧
就是太热了里面,温度高,虾上的太慢了,吃着不舒服
服务不好,我还用筷子捞给他看了还是不相信人,心情很不好,特烦人
海鲜种类倒是很多
没什么可选择的,东西太少,吃得一般般
容易摔倒,不过他家地有点滑
的扣上一个错后痛不痛候个错误不理他谈了特通好心情愉快给这个我让破搂你诺咯很
不过现在这服务态度是越来越差了,门口负责登记排队那小伙儿该换了,去了多少次都记不清楚了
鲍鱼小的可怜,服务一般般,菜品太少,螃蟹都是死的,一般般
你们上哪找到那么不肥的螃蟹,不是说差这六块钱,你们还能找到比我图片上照出来的再小的鲍鱼吗,有些日子没去鼎香缘了,总结不要赶在周末高峰时间去
以后可能还是会去的
带壳类海鲜是死的,肉质不好,都是大肥肉,吃的有点想吐,海鲜种类不多
就是有点油大
东西还跟往常一样,突发事件处理真的太差
但是他们家服务员的态度是真心不怎么样
就是有个服务员换个锅说了半天
挺生气的,今天居然说要预约
