而我点的煮辛拉面,又点了个辛拉面,卖家说菜单的价格是纯包装的,店面很小,不知道咋说,但菜单显示的价钱比实际价格完全不符
环境特别差,糯米也没熟,好像吃了个假鸡汤
服务就变低了,服务态度不好,本来是一只鸡汤,点的菜量也少了,地方也不好找,环境一般,就给半只
希望这家参鸡汤千万别走下坡路
给的也少,口感相当不好,而且小白种类少,不划算,口感相当不好??,味道也不好
找了快半个小时靠导航根本找不到
退款态度不好,吃出异物,你要是到下午休息你就别接待了呗,没吃完饭服务员都拿被睡觉了
方便面八块钱一份有一些贵,就是米饭5块钱一份
提醒各位一定不要吃之前就告诉用美团卷,那干脆就不要设置团购好了,团购的就都给大骨头,结果里面的脊骨差别太大了,结果都快吃完了才加,却说什么脊骨都是称好的,团购的和直接到店的脊骨根本差太多,第一次和朋友去吃完之后才告诉用美团
地方不好找
不过涨价了,现在68,米饭5块一碗
参鸡汤味道一般,服务态度有待提高啊,什么态度
不过上菜很慢啊
就是饭的量能小些
那一脸不乐意的样,告诉再不给加了,立马就变脸
价钱贵一倍的菜品,服务员牛气的没活说,我没看到,她反倒说你没看到
就是米饭五元一碗有些贵
量不是很大,点菜也不冷不淡,就是很冷很冷很冷啊,不冷不淡,11点去的时候
太咸,一般吧,服务态度差,要不是离家近不会吃第二次了
服务差差差
必须差评,就这服务态度
服务差,差差差
其它菜品都挺贵
这个价值,米饭5元一碗有些小贵
感觉参鸡汤没有以前好吃啦,服务员不够用
就是地角不好找
一般吧,鸡不大,太烫了,糯米太多了
米饭有点贵
然后环境的话稍微人多一点的话烟味会比较重一些,嗯,服务的话
人不多但是服务生态度冷淡,可能是已经过了饭点
望改进,但餐具应该再干净一些先是筷子像用过了一样,碗也没洗干净
不想再去了,味道不怎么好,量很少,态度也一般吧,感觉没什么吃的
量一般,米饭也太贵了
都排不上位置,参鸡肚子里有很多糯米就可以吃饱了,如果是一个人吃,人太多了
就是米饭5元有点,不止一次的来了
一点也不好吃,不会再去了
连个招呼的都没有不想说太多,进门能有一分钟,太差了反正
不知道是因为团购的原因才这样吗,集中的糯米根本就不粘糯,以后不会再去他家吃饭了
希望上菜的时间再短点
贵还不好吃,以后不回去了,跟韩国比味道差远了,不怎么好
菜品口味一般,厨房环境不好,身上的油烟味两三天才没有,油烟味太重
可能是客人多了点,服务不是十分满意
汤像清水似的,吃完回家就拉肚子
就是停车费劲
或者禁止吸烟吧,室内空气质量不太好,可能是周末人多的原因
服务员态度也不热情,和在韩国随便一个小店吃的差距太大,鸡肚子里的糯米太硬,米颗粒大,一副爱吃不吃的态度,环境一般
单买的烤牛肉饭,与“烤”无关,明明是圆葱炒牛头片盖饭,食之无味
就是量很小很小很小很小
服务不好,二话不说,老是用命令的语气就是穿蓝鞋个子挺高扎着马尾那个女服务员
人不太多
就是地方有点偏,环境一般
那个收银员的态度真不怎么样
应该是换老板了,没有原来好喝了
感觉不太值,不团也这价,量不多
两个人没吃完,没有提醒不要辣的,锅有点辣
那个炕对孕妇来说太遭罪了,回到家浑身都是油烟味,屋里油烟味大
所以觉得特别不好找
油烟味有点大,熏的衣服都是那个味道
地方不是很好找
看着}的慌参鸡汤,整个大厦都冷清,地方有点偏
好多团购不不能用了,就是过了中午时间
上菜巨慢,位置很偏,感觉就是团购的原因,才上来,是在一再催促下
除了参鸡汤,价格太贵,就是他家的炖牛尾,就是份量太少
但是我还是给了服务差,然后点的餐,给我的理由是不是我给您点的餐,我是进去就给点餐的服务员看团购的号了
菜品就很贵了,分量少
服务差点
送的小菜海带特别不好吃,说完是团购用很硬的语气说还点别的吗,也没指望服务态度,不太好,汤也没有味道,也是有别的菜品价格太高的原因,还没味道
但是服务员态度不好
不培训么,服务人员的意识应提高,叫人服务,进门头不抬,态度还冷漠,也不打招呼
去的时候下午三点了,孕妇没事就补补
还有几个大姐态度很希望改进,不能因为是团购就有差别对待
欠你的麽,服务员态度实在是太不好了
三个人花了快3白了,点菜的人把我们团购的点错了害的我们买单花了很多钱
就是服务差
服务员服务意识该培训培训了,点的米酒忘了没给上叫服务员瞅了一眼都不过来问问怎么回事,服务态度不是很好
服务员服务意识该培训培训了,点的米酒忘了没给上叫服务员瞅了一眼都不过来问问怎么回事,服务态度不是很好
很过分,这个差评是给今天吃的脊骨火锅的,十分的气愤,糊弄团购的顾客,服务差
早知道还不如团个拌饭,鸡汤很淡,米饭很贵
重点菜也格外难吃,服务员还想让我留下菜还想把责任推给我们,还炸的特别丑看着就难吃,服务质量太差,菜做的也不如以前,我说没做就不上了
劝大家也考虑吧,她家服务员态度超级差劲,再也不会过来吃了
点的韩式火锅,感觉不太值,里面没什么东西
不知道为什么,哎,没有以前好吃了
就是服务员态度很令人害怕
验证为什么拿我手机,答去验证,答手机上有验证码,就不能你把码抄下来去验证吗
还是根本不想服务,两次对服务员态度不满意,叫了好多遍都不放声,真不知道是没听见,双手喇叭状最大嗓门喊一句
团购28比店里48便宜
服务也不好,基本的韩餐店服务都没有,不会再去了,一般般,上菜慢,不喜欢菜的味道
我们真心很小声的啊我们都搞不清楚谁是客人谁时服务员了,你问什么都回答的你很闹心,不知道他们家还要休息的,我和朋友吃饭唠嗑还被服务员说了,反正服务超级烂
环境不如从前了,就是人太多
环境也不是很好,服务就不怎么不样
就是没有空调太热了
服务员非常冷淡
还是根本不想服务,两次对服务员态度不满意,叫了好多遍都不放声,真不知道是没听见,双手喇叭状最大嗓门喊一句
还是根本不想服务,两次对服务员态度不满意,叫了好多遍都不放声,真不知道是没听见,双手喇叭状最大嗓门喊一句
因为是团购服务态度极差,可恶,爱理不理的样子
点菜时我们菜点重样也不说一下,爱搭不理的,服务员态度太差
看着完全没食欲,肯定就是回收菜,小菜根本不敢吃,太差了
个人觉得不值这个价钱,海鲜葱饼太一般,还有一点小虾仁和蚬子肉
第二次去了
不新鲜,不团购真是价格偏贵,不会再去啦,一共花了110左右,而且味道一般
地方不好找
汤没以前好喝,港湾一号扶梯也不开,空调也不开,服务态度也差劲,使得环境不是那么舒适
但也有时不愿意来,不过服务员比以前那个大嗓门的阿姨好多了,但是他家的参鸡汤实在是质量下降的太多了
石锅拌饭油太大啦,感觉上菜很着急
他们说能用,去之前问团购卷能用吗,可是服务员竟然说自己很忙告诉我不能预约,去了又说团购的卖完了
就是贵了点
实在不满意,因为味道了不好,感觉一般般
结果饮料三口喝完了,三份饮料加两份米饭又花了我60多大洋,但是饮料太贵了
不划算,只有这个感觉,跟咸很闲很咸
本来以为有电梯可以上去的,结果发现二楼没有电梯,地方有点难找,参鸡汤的鸡肉一般般,肥牛饭一般吧
饮料太贵了,不过还是建议去的朋友自带一些水吧,估计商家把菜品的钱加到饮料里了
蘑菇根都在里面,俩人根本不够吃,两小根年糕还很难吃,根本不值58,太不值,骨头不新鲜
一点也不好吃,很小很小的鸡,说好的人节操呢
就是有点闷热
不能再去了,特别难喝,太难喝了
之前的不想了,汤快喝完了竟然吃了半根头发出来,剩下的不喝了,把汤换掉算了吧
结果上来是炒的,虽说图片仅供参考,服务员说炒炸5鸡,可是菜单的图片和实物完全不一样,服务也一般,但是图片是鸡排啊,环境一般吧
停车挺不方便
另一桌当时就说她服务态度差她理都不理,另一个胖一点的服务员还跟另一桌团购的吵起来,没人消费的时候爱看一张哭丧的脸,我想说既然你弄团购了就好好做,还一副爱谁谁的样,但服务真的很差,我不知道你们家老板会不会来看评价
再也不会去了,在大连去过服务态度最差的店,问服务员事情跟吃枪药似的,这样的店我想知道怎么还有那么多人愿意去,态度太差
地方不太好找装修略显陈旧鸡汤很淡没看着有参海鲜饼还不错
地方需要找一下,但参鸡汤味道淡,和韩国差不多
要求不高的可以,不好停车,辣白菜太酸,不好吃,味道真的一般
绝对不会去了,服务员很差,反正就是一次很不好的经历
上菜有点慢,鸡肉很软
80分以上,总体还是,就是环境差了一点儿
吃完不饿了,一般吧
不是第一次来了
肉烂
就是楼下不太好停车
我不是饭点儿去的而且还没团不让吃我就走他们才让我进的,口味不是特别惊艳,但是不难吃
菜量超小,价格很贵,超级差鱼不新鲜,不会再去第二次
原本就团了一个参鸡汤,但是在等的时间有点了一个炒杂菜,没有预约就去了,等的时间有点长
是不是人很多的原因呢,点其他吃不下
越来越不好吃,一般吧,热
吃了包肉,还有一个锅团购也很贵
一般比起首尔的参鸡汤差很多米就少很多
喝了鸡汤心情更差,心情很差,做了半天没人招呼,还有人抽烟
就是放的歌我不太喜欢
我家宝贝都吃恶心了,差点吐,太难吃了
所以糯米没吃几口
味道越来越差,服务态度极差,再也不去了,很小一只鸡,鸡汤不浓郁
本来不可以再加小菜的,结果要了就给了一大盒
需要等,不枉费我等那么久,1点多去的告知参鸡汤已经售空
露出一副没见过你们这么吃东西的表情,服务员的态度不是很贴心,吃完饭搞得一身一头油呼呼粘粘的味道,但是服务员不应用自己的眼光去判断客人
我吃饭看你脸子来了,对于这种服务一星都不想给,对于九月二十二号晚的前台服务员态度极其恶劣,不知道菜里有啥,不知道份量够不够,感觉做生意不容易
还没有家乐福里卖7块的半成品冷面好吃,还有他家冷面不好吃
里头的鸡竟然少翅膀,就是服务员的态度有待提高,服务员很不情愿地换了一锅,第一次上的汤里有小虫
地方小了点,服务员服务不是很及时
就是服务不好,让人感觉很不舒服,就算再好吃也不来了,一边打电话一边结账一点礼貌都没有
只是比较贵
脊骨火锅小,但是团购涨价了,味道跟以前一样
就是没有车位
东西有点少,感觉就是东西随着钱变少了
总体贵,没有期望的好,是炒的,量少,鸡块炒大白菜
希望以后能保质保量
25,基本都没吃,25全是苹果有几个橘子估计是罐头,太不好吃了
就是地方太不好找了
什么都不想再讲了,就是太不好吃啦
问服务员,服务员不耐烦的说,店内没有客人
比粘米还粘,拌饭那个饭简直了,在也不会吃了
汤不好喝,不好吃,后悔莫及,饭也是不喜欢
停车不方便
但是店内服务员少,也不是很热情
老板人很差,可是服务真的很不好,还说顾客
点个菜爱搭不理,吃的也就那样吧,服务态度差的不能再差
就是有点贵,呵呵呵
就是米饭五元,略贵
饭不好吃,水平严重没有希尔顿的水平
就是太慢了上餐
再给这么少下次可就不去了,不知道是不是团购的原因,就是牛尾汤给的太少了
怎么会有人问啊,就是太贵啦
菜味太一般,服务也是不咋地,菜品少,不会再来
接电话让人听不清楚,我在电话里说听不清楚,我正常消费还不行,刚刚接电话的服务员还故意在我们旁边很大声的说,睡觉倒是别接电话呀,服务态度极差,不方便就别接电话
除了葱味什么味都没有,告诉他是给病人吃的不要葱姜蒜,破打包盒还5块钱
但是环境和服务差强人意,还有不团购的话很不合适
但是石锅拌饭里面有头发是怎么回事,失望
服务员没有任何阻止行为,总之不会再去了,在旁边说说笑笑,今天去吃还有带狗去的,味道也和之前差了很多
都没吃饱,后悔了
吃得不开心,不再去了,服务员都没有一个有笑容,可服务是越来越差
不方便停车啊
价格贵,真心不好吃,这个店实在是不怎么样啊,第一有评价的需求是因为实在更吐槽一下,再也不去了
店名叫“宫廷参鸡汤”,鸡汤没点鸡味,没看出来也吃不出来是烤的,整个汤里没发现参在哪,烤牛肉饭和外面卖的一般牛肉饭一样
车难停啊,但是
餐具不干净
单点48太贵了
好贵的啊,个人不会再去了,味道一般,凑合吧
其他人的服务也是醉了,以前有个小姑娘
鸡汤很淡很淡很淡,牛肉饭比吉野家差远了
服务不怎么样牛的很,量小不够两个人吃
冲着点就不想去,但不会再去了,像桑门似的
打包费一份菜就要5元,鸡汤葱味重,菜价偏贵
结果我们去到店里买的79元券才吃上,店员说必须至少提前三个小时预定才可以用
参鸡汤很一般吧牛尾汤比较小,不会再想吃了服务比较差,没人理啊
对团购的客人限制比较多,就是服务有待提高
不团购好贵呢
就是袖珍了一些
男的不够吃,就是小了点
服务态度不太热情
需要早点
参鸡汤的鸡很小,态度不太好
小了很多,味道还是一样的
挺贵啊,一碗5元
你说黑不黑,非得让提前预约2小时,没预约到了有座都不招待你,他家太恶心了
但是服务员的态度不敢恭维
汤一点味道都没有,越做越难吃啊
东西也没以前好吃,白毛高丽棒子老头没了,服务越来越差
就是离我远点,去到又点了角瓜饼,也是少了点,米饭贵点
服务员木讷的很
米饭太贵了,真心吃不起米饭啊,也不知道新鲜不新鲜,肉是炖过得
点的大酱汤
为毛鸡肚子里是米,不咋的
量也不是特别大,确实不知道为什么评论里那么多人都说好,味道一般,脊骨火锅要是不团购到店吃是100元,脊骨火锅感觉不出来哪里特别好
人少---汤正,就是地方难找
菜品挺贵的
特别前台收银小伙,服务不怎么滴,结果十二点半才上菜,特瞧不起团购
跟朋友去吃的
然后态度很恶劣摔电话,差评不解释,打电话给店家声音很小根本听不清
影响心情,不想再来第二次,前台收银男的服务太次
是不是好贵,就是打包费要五元
就是牛肉68感觉很不值,还不如一碗30的牛肉饭好吃
碗小的可怜不说,单点也就罢了,竟然要五元钱
但一小碗米饭需要5元钱
又到了和参鸡汤的时候了,就是价格一直再涨入秋了
一看是团购各种不满的样子东西其实味道挺好的,东西其实这个价不太贵但是前台的小姑娘态度不太好
可是服务员左来一个说一遍,就是服务员的态度差些
不太好停车
就是每次打电话预约比较费劲
可能是人多的关系,前台的服务态度很差,东西上的很慢,答应了半天都没回复,服务员都叫不到
团购不是花钱去的吗,有点瞧不起人的感觉,这帮看人低的老娘们讨厌,团购怎么了,就是服务太差
一碗米饭居然5块,价格也不便宜,真是很一般,味道一般
就是米饭太贵
能不能行了,臭了都,鸡都有味了还给顾客上啊
算了,很热的天不开空调,但是基本没有服务
停车不方便
这点不好,还点了很多其他的东西呢,就让坐那么憋屈的小桌子
太不合适了
没吃了,缺点是服务员态度太差
鸡肉口感很差,只给一份小菜,服务态度别提了,作为服务员这态度,下次再也不会去了,很不新鲜
整体一般,单点菜品单价都偏贵
其他的都很贵
跟在韩国吃的差好多,但是店家老板是韩国人,做出来的味道,却失望了
说话很生硬,打电话预定的时候接电话的人态度好差
第一次去的可一定查查路线,可是服务真的很差,打电话问具体地点
欺骗消费者吗,也不会推荐,总之不会再去了,所以就可以弄虚作假
很失败的一次团购,很淡,味道不是很好,额外叫的辣白菜炒饭也不好吃,再不会来了
服务差,规定日期
其他菜品贵,虽说和在韩国吃的有些差异
接电话的男的永远令人那么反感
下次不敢吃了,鸡有一股味儿,味道变了
感觉很是不热情,就是里面那个男服务员
特别差,像得罪服务员似的,感觉不是一起炖的,肯定不会再来,菜品的味道也不好,服务特别差,太差了
只是鸡变小了,鸡汤味道没有变,很久没去了
那个男的我好像骂他,打一次电话我生气一次一听团购态度马上恶劣,非常装
就是太贵
点了汤烤肉,服务员态度太差,态度太差,2点去,白瞎了好参鸡汤
服务真的很差,若多人去另外再约就会告诉已经满了,冲着这个服务真心不想再去
老顾客了服务员态度还是一如既往的不好
米饭5元钱一碗是不是有点儿离谱呀,5元钱一碗,是我吃过最贵的了
脊骨很多肉,就是米饭贵了点5元一小碗
停车不方便
说话服务态度都特差,告诉后厨还没下单子做,就是服务态度血差
不会再去,似乎美团不是给她们送钱,两人用餐只给一份小菜,而且服务员态度很差,口味很一般,感觉很不好
里面的糯米饭是凉的,好失望的,越来越差了
服务员都不知道跑哪了,问后厨根本不搭理
让人感觉花钱的顾客似乎欠他们的,服务太差
服务态度好差,团购就不是顾客么
但是米饭太贵了,竟然5块一碗,就是一般大米饭啊
就是服务员服务态度太太太差,反正我是吃完这次不会再来了,老板真的该考虑一下这样的服务员会不会给你的店带来效益
就是服务员态度很差,餐具不怎么干净
是不是它家团不起了啊,去了又说代金券不能一起用,再也不去了,全部不能一起用,太尴尬了
看图片上是有碗小汤的,但吃的时候却没有给汤我
可能是厨房的排风出了问题,鸡里包的糯米略咸,这家店所在的二楼油烟味很重
米饭五块确实有点贵
竟然吃出了排骨汤的味道,再也不去了,味道变了
米饭好贵
刚进门的热情劲全无,一听说是团购,态度就立刻180度转弯,手一指就把我们安排在一个角落里
就是打包都没给带调料希望下次不要忘了
真心不会再去了,米饭都不配的,根本吃不饱不说,那些评价都是伪造的,才明白
环境一般,口味一般,态度不大好
服务态度很差,来了都没有人招呼,味道一般吧,再要人家半天磨磨蹭蹭不愿给,这样同样的东西照样得给5次,鸡都没熟,5个人坐那看半天不敢轻易动筷
毕竟是少赚了不少,汤没啥鲜味,态度特别差,应该不会再去他家吃参鸡汤了,就像我们没给钱,糯米少
就是服务员有点少,每次需要服务都很长时间才有人答应
非常的不好,美团,还说脏话,让我自己和美团,团购的不好
好像是吃多大亏似的,搞不起就别搞,熟不知一多半客人是因为团购才带去,对待团购客人待搭不理的,差别对待让人很不舒服
让加还很不情愿,就是给小菜非常抠门
没法跟之前比啊,汤锅味道不纯正,服务员态度冷淡,没有以前韩国老板娘在的时候好吃
服务态度不怎么好,结果没有,说是赠小菜,味道一般
但是就是预订的时候服务员态度不好,很不耐烦
因为是美团安排个很偏得角落,服务真心不咋地,店家很小农意识
味道一般服务差爱搭不理无感不会再光顾
量少得可怜,点的石锅拌饭
不到20一份参鸡汤
,服务态度很垃圾,这种服务态度的店只能说是垃圾,服务员解释电话没人接是因为电话不大好用,这是理由吗,老板要不提高服务员素质
实在不能昧着良心说好吃,这个脊骨火锅跟我原来去过的韩国店比做的差远了,结果太令我失望了
空气不好,热,口味一般,没窗户
过几分钟上来的是退掉的那份,要求更换,而且有厚厚的一层恶心物质,参鸡汤里的鸡发黑
得不偿失,这种店不会再去,像他家种服务搞不起团购就不要搞呗
服务员一点也不热情,我严重怀疑上面的是托
大梁骨肉很多,团购本身不带主食
觉得有点贵
糯米软烂鲜香
吃过了很多韩国店的冷面它家的冷面真的太一搬不好吃
个别服务员的态度可真是不怎么样好像我们欠她钱似的,个别服务员的态度可真是不怎么样,食材不是特别新鲜不过这个价格还好啦味道不错,就是空调不够给力,环境还可以就是空调不够给力吃得很热
参鸡挺好吃的环境不咋地,太热了,环境不咋地
冷面也不是很好吃
很影响食欲,建议大家订座时说自己是三个人,双人座真不敢恭维
不知道是不是一家的,团购过旁边一家店的,原价不愿意去的,味道一般般吧,服务态度不敢恭维,不要小菜都不给上
服务态度真的不是很好,第二次来了服务态度真的不是很好
对于中国客人和国外客人的待遇很不满意,对于服务不满意
略少
一般肉不好吃米饭太贵
我感觉没有以前的味道了
量大不如前
服务态度不好
服务差劲
真的看到一小部分参,好像看到几个韩国的人来吃饭,参鸡汤需要自己调味
再也不会去,下次不会再去了,收银台那个女的服务态度特别差,她是摆出一副老板的架子,一般,但是我记得老板是个老头
莫名其妙的出现在了饭桌上不明所以的吃掉了我很好奇阿姨是前一天晚上看奥运和继科欧巴一样犯了瞌睡症是嘛??没办法这样吧,莫名其妙的出现在了饭桌上不明所以的吃掉了我很好奇阿姨是前一天晚上看奥运和继科欧巴一样犯了瞌睡症是嘛没办法这样吧,没有点土豆沙拉
菜品一般,连个空调都没有哦,服务一般
总感觉吃出一股豆腐脑炒大葱的味道,里面的糯米根本就没熟,吃的挺失望的,里面的糯米根本就没熟总感觉吃出一股豆腐脑炒大葱的味道,感觉味道一般般抱着很大的期望去的
鸡汤飘油花需要改进,不催不给空调需要改进,服务员板着脸需要改进
量也不是特别大,确实不知道为什么评论里那么多人都说好,味道一般,脊骨火锅要是不团购到店吃是100元,脊骨火锅感觉不出来哪里特别好
在二楼
菜的量实在是太少了,估计也不够新鲜
脊骨火锅小,但是他家的米饭真的是不值得,真的是不划算
但是榻榻米的地方没有空调,整个吃的过程很煎熬
一点不好吃,吃的太差,还热的不行,好不容易开车过去了
应该是因为团购吧,人太多
太热了,最重要的一点是没有空调
地方不是很好找,找了半天,参鸡汤口味偏淡
发现后店家也没有任何解释和道歉,爸爸牙不是很好,店家上饭菜的时候不仔细检查么
服务员态度差,口味一般,不会去了
要不吃个饭真累,也不吃不出味道,我个人感觉来这种地方吃饭得和志趣相投的人来才行
走的时候没找钱,服务员态度不怎么样,要了一碗米饭5块钱,普通米饭5块钱一小碗,给了10块,可是我们都走到门口也没喊回来说钱没找
就是吧台收银那姑娘态度好差呢
环境
米饭5块钱一碗好贵
吃出不干净的东西,再也不会去了,不好,商家也没有好的态度,而且去吃个饭从头到尾都没看到服务员有个笑脸,请问你家服务员是不是都刚失恋
是个好女孩,鸡肚子里塞的满满的糯米
不太喜欢,服务态度也不好,感觉好恶心
还有新的服务员态度有点急躁,但是真是这四年看着参鸡汤一直在涨价呀??希望不要再涨了吧
这回也不说是留台了,再也不想去了,去了服务员特别不好,菜味道超级一般,服务员还说不吃拉倒,感觉太一般了,然后说都是留台的什么的
不过貌似不管几个人都是这些小菜,人多吃就不够啦
就是地方很热
饿再吃其他的东西如果你稍微呆一会儿的话,但是真的是太热太热了,而且通风不是特别好
就是找不到路的时候服务员态度不太耐烦,他们家搬出来了
还把眼镜落在店里了,去的时候没有人
不知道为什么味道差太多,换了新地址
菜量不多,中午的优惠套餐真是越来越贵了
